CoordenadorID;Nome;Afiliacao;RefID;RefNome;Estado
8592300724397366;Carlos Eduardo Oliveira Andrade;Centro Federal de Educação Tecnológica de Minas Gerais, CEFET/MG, Brasil.;8592300724397366;Carlos Eduardo Oliveira Andrade;Minas Gerais
6878718102770367;Rodrigo Luis de Souza da Silva;Universidade Federal de Juiz de Fora, UFJF, Brasil.;6878718102770367;Rodrigo Luis de Souza da Silva;Minas Gerais
2847901878340953;Antonio Lopes Apolinario Junior;Universidade Federal da Bahia, UFBA, Brasil.;6878718102770367;Antonio Lopes Apolinário Junior;Bahia
8226406163217491;Roberto dos Santos Bartholo Junior;Universidade Federal do Rio de Janeiro, UFRJ, Brasil.;5399173621955960;Roberto dos Santos Bartholo Jr.;Rio de Janeiro
3284179037499048;Antonio Carlos dos Santos Souza;Instituto Federal da Bahia, IFBA, Brasil.;3284179037499048;Antonio Carlos dos Santos Souza;Bahia
0170862557823567;Maurício Rosa;Universidade Federal do Rio Grande do Sul, UFRGS, Brasil.;170862557823567;Maurício Rosa;Rio Grande do Sul
9261035835015495;Patrícia Fernanda da Silva;Universidade Federal do Rio Grande do Sul, UFRGS, Brasil.;9261035835015495;Patrícia Fernanda da Silva;Rio Grande do Sul
4607042780750206;Aléxia Pádua Franco;Faculdade de Educação da Universidade Federal de Uberlândia, FACED UFU, Brasil.;4607042780750206;Aléxia Pádua Franco;Minas Gerais
4339989455841703;André Luis Marques da Silveira;Pontifícia Universidade Católica do Rio Grande do Sul, PUCRS, Brasil.;4339989455841703;André Luis Marques da Silveira;Rio Grande do Sul
7909125807301431;Fabiano Utiyama;INSTITUTO FEDERAL DO PARANA, IFPR, Brasil.;7909125807301431;Fabiano Utiyama;Paraná
7835935043066010;Eloisa Dezen Kempter;Universidade Estadual de Campinas, UNICAMP, Brasil.;7835935043066010;Eloisa Dezen Kempter;São Paulo
7221692456270122;Isabel Cristina Siqueira da Silva;Fundação Universidade Federal de Ciências da Saúde de Porto Alegre, UFCSPA, Brasil.;7221692456270122;Isabel Cristina Siqueira da Silva;Rio Grande do Sul
1377022547816780;Diego Gervasio Frías Suárez;Universidade do Estado da Bahia, UNEB, Brasil.;6747210702910392;Diego Gervasio Frías Suárez;Bahia
1562357566810393;Luiz Marcos Garcia Goncalves;Universidade Federal do Rio Grande do Norte, UFRN, Brasil.;4903908392101557;Luiz Marcos Garcia Gonçalves;Rio Grande do Norte
0319800678858096;Marco Antonio Costa Simões;Universidade do Estado da Bahia, UNEB, Brasil.;325157122452319;Marco Antonio Costa Simões;Bahia
8258852785816571;Yara Rondon Guasque Araujo;Universidade do Estado de Santa Catarina, UDESC, Brasil.;8258852785816571;Yara Rondon Guasque Araujo;Santa Catarina
6614550860293610;Guido Lemos de Souza Filho;Secretaria de Ciência e Tecnologia de João Pessoa, SECITEC, Brasil.;6614550860293610;Guido Lemos de Souza Filho;Paraíba
2227324756659206;Frederico Menine Schaf;Universidade Federal de Santa Maria, UFSM, Brasil.;2227324756659206;Frederico Menine Schaf;Rio Grande do Sul
4274277189418426;Elisa Henning;Universidade do Estado de Santa Catarina, UDESC, Brasil.;4274277189418426;Elisa Henning;Santa Catarina
4284493226597009;Giselle Martins Venancio;Universidade Federal Fluminense, UFF, Brasil.;2482007463791395;Venancio, Giselle Martins;Rio de Janeiro
6965119196945931;Alessandro de Lima Bicho;Universidade Federal do Rio Grande, FURG, Brasil.;6965119196945931;Alessandro de Lima Bicho;Rio Grande do Sul
4282224955491397;Daniela Gorski Trevisan;Universidade Federal Fluminense, UFF, Brasil.;4282224955491397;Daniela Gorski Trevisan;Rio de Janeiro
0429575742156021;Ines Maria Silva Maciel;Universidade Federal do Rio de Janeiro, UFRJ, Brasil.;429575742156021;Ines Maria Silva Maciel;Rio de Janeiro
0956823002875182;Rodolfo Pinto da Luz;Centro Universitário Euro-Americano, UNIEURO, Brasil.;1728783224542391;Rodolfo Pinto da Luz;Distrito Federal
7541399131195077;Raul Sidnei Wazlawick;Universidade Federal de Santa Catarina, UFSC, Brasil.;6186413528999908;Raul Sidnei Wazlawick;Santa Catarina
9944681520075532;Jose dos Santos Cabral Filho;Universidade Federal de Minas Gerais, UFMG, Brasil.;9944681520075532;Jose dos Santos Cabral Filho;Minas Gerais
8529032048850930;João Luiz Bernardes Júnior;Universidade de São Paulo, USP, Brasil.;8529032048850930;João Luiz Bernardes Júnior;São Paulo
7335283291788181;Clóvis de Arruda Martins;Universidade de São Paulo, USP, Brasil.;8529032048850930;Clóvis de Arruda Martins;São Paulo
0883301163870314;Alvaro Jose Rodrigues de Lima;Universidade Federal do Rio de Janeiro, UFRJ, Brasil.;883301163870314;Alvaro Jose Rodrigues de Lima;Rio de Janeiro
4877438997744133;Marcio Teixeira-Bastos;University of Münster, WWU MÜNSTER, Alemanha.;4877438997744133;Marcio Teixeira-Bastos;
4093653182381054;Carla Maria Dal Sasso Freitas;Universidade Federal do Rio Grande do Sul, UFRGS, Brasil.;4093653182381054;Carla Maria Dal Sasso Freitas;Rio Grande do Sul
5632602851077460;Isis Didier Lins;Universidade Federal de Pernambuco, UFPE, Brasil.;5632602851077460;Isis Didier Lins;Pernambuco
7954579511036422;Francisco dos Santos Rebelo;Faculdade de Arquitetura da Universidade Técnica de Lisboa, FA-UTL, Portugal.;2927011145636179;Francisco dos Santos Rebelo;
6712094636172729;José Eduardo Pompeu;Universidade de São Paulo, USP, Brasil.;683836610965593;José Eduardo Pompeu;São Paulo
9576713124661835;Rossana Maria de Castro Andrade;Universidade Federal do Ceará, UFC, Brasil.;5641112041037627;Rossana Maria de Castro Andrade;Ceará
1049090105081864;Noêmia Lazzareschi;Pontifícia Universidade Católica de São Paulo, PUC/SP, Brasil.;1049090105081864;Noêmia Lazzareschi;São Paulo
0260303520888425;Bruno Bogaz Zarpelão;Universidade Estadual de Londrina, UEL, Brasil.;260303520888425;Bruno Bogaz Zarpelão;Paraná
4512074340599645;Umberto Celli Junior;Faculdade de Direito de Ribeirão Preto- USP, FDRP, Brasil.;4512074340599645;Umberto Celli Junior;Pernambuco
2491891766759477;Carlos José Pereira de Lucena;Pontifícia Universidade Católica do Rio de Janeiro, PUC-Rio, Brasil.;2491891766759477;Carlos José Pereira de Lucena;Rio de Janeiro
1426401706315442;Otto Carlos Muniz Bandeira Duarte;Universidade Federal do Rio de Janeiro, UFRJ, Brasil.;6534637358360971;Otto Carlos Muniz Bandeira Duarte;Rio de Janeiro
7652960701727650;Reymard Savio Sampaio de Melo;Universidade Federal da Bahia, UFBA, Brasil.;7652960701727650;Reymard Savio Sampaio de Melo;Bahia
2869923054936837;Luis Hernan Contreras Pinochet;Universidade Federal de São Paulo, UNIFESP, Brasil.;2869923054936837;Luis Hernan Contreras Pinochet;São Paulo
5485189907016634;Jorge Renato de Souza Verschoore Filho;Universidade do Vale do Rio dos Sinos, UNISINOS, Brasil.;5485189907016634;Jorge Renato de Souza Verschoore Filho;Rio Grande do Sul
7302726381067992;Bernardo Machado David;IT University of Copenhagen, ITU, Dinamarca.;7302726381067992;Bernardo Machado David;
3696299629938135;Miriam Christi Midori Oishi Nemoto;Universidade Federal de São Paulo, UNIFESP, Brasil.;3696299629938135;Miriam Christi Midori Oishi Nemoto;São Paulo
5486578243421803;Ricardo Augusto Rabelo Oliveira;Universidade Federal de Ouro Preto, UFOP, Brasil.;5486578243421803;Ricardo Augusto Rabelo Oliveira;Minas Gerais
7269686606912444;Marcelo Duduchi Feitosa;Centro Estadual de Educação Tecnológica Paula Souza, CEETEPS, Brasil.;8463651002688096;Marcelo Duduchi Feitosa;São Paulo
6874544707185541;Marcos Antonio Simplicio Junior;Universidade de São Paulo, USP, Brasil.;8587567074814594;Marcos A. Simplicio Jr.;São Paulo
4942609302112746;Bruno José Torres Fernandes;Universidade de Pernambuco, UPE, Brasil.;5941653866734201;Bruno José Torres Fernandes;Pernambuco
3614256141054800;Jose Neuman de Souza;Universidade Federal do Ceará, UFC, Brasil.;6631267110894080;DE SOUZA, JOSÉ NEUMAN;Ceará
3322255992735977;Joaquim Vinicius Carvalho Assunção;Universidade Federal de Santa Maria, UFSM, Brasil.;3322255992735977;Joaquim Vinicius Carvalho Assunção;Rio Grande do Sul
1207757858897815;Lázaro Eduardo da Silva;Centro Federal de Educação Tecnológica de Minas Gerais, CEFET/MG, Brasil.;1207757858897815;Lázaro Eduardo da Silva;Minas Gerais
4161777289889227;Juarez Freitas;Universidade Federal do Rio Grande do Sul, UFRGS, Brasil.;4161777289889227;Juarez Freitas;Rio Grande do Sul
6720552935529976;Juliana Oliveira Domingues;Universidade de São Paulo, USP, Brasil.;6720552935529976;Juliana Oliveira Domingues;São Paulo
5326223719623265;Leonardo Lima Gomes;Pontifícia Universidade Católica do Rio de Janeiro, PUC-Rio, Brasil.;5326223719623265;Leonardo Lima Gomes;Rio de Janeiro
3725098495803766;Gilson Schwartz;Universidade de São Paulo, USP, Brasil.;6874544707185541;Gilson Schwartz;São Paulo
4641684220602580;Célio Vinicius Neves de Albuquerque;Universidade Federal Fluminense, UFF, Brasil.;4205779497458915;Célio Vinicius Neves Albuquerque;Rio de Janeiro
6177045546956476;Diogo Menezes Ferrazani Mattos;Universidade Federal Fluminense, UFF, Brasil.;4205779497458915;Diogo Menezes Ferrazani Mattos;Rio de Janeiro
2448703093928632;Debora Christina Muchaluat Saade;Universidade Federal Fluminense, UFF, Brasil.;4205779497458915;Débora Christina Muchaluat Saade;Rio de Janeiro
7060564895078069;Júlio Cesar Andrade de Abreu;Universidade Federal Fluminense, UFF, Brasil.;7060564895078069;Júlio Cesar Andrade de Abreu;Rio de Janeiro
4513485062469304;Rodrigo Flora Calili;PSR Consultoria, PSR, Brasil.;4513485062469304;Rodrigo Flora Calili;Goiás
2912504494560823;Sílvia Beatriz Beger Uchôa;Universidade Federal de Alagoas, UFAL, Brasil.;2912504494560823;Sílvia Beatriz Beger Uchôa;Alagoas
7716805104151473;Carlos André Guimarães Ferraz;Universidade Federal de Pernambuco, UFPE, Brasil.;7716805104151473;Carlos André Guimarães Ferraz;Pernambuco
4531178739960001;Carlos Eduardo Ferreira de Carvalho;Pontifícia Universidade Católica de São Paulo, PUC/SP, Brasil.;4531178739960001;Carlos Eduardo Ferreira de Carvalho;São Paulo
7647023564369066;Rogerio Antonio Casagrande;Universidade do Extremo Sul Catarinense, UNESC, Brasil.;7647023564369066;Rogerio Antonio Casagrande;Santa Catarina
0807511237795775;Alessandro Fabricio Garcia;Pontifícia Universidade Católica do Rio de Janeiro, PUC-Rio, Brasil.;1095304607841635;Alessandro Garcia;Rio de Janeiro
0721071524157651;Jerffeson Teixeira de Souza;Universidade Estadual do Ceará, UECE, Brasil.;9359546788802277;JERFFESON TEIXEIRA DE SOUZA;Ceará
2323279755124770;Martín Augusto Gagliotti Vigil;Universidade Federal de Santa Catarina, UFSC, Brasil.;8730750961111658;Martin Augusto Gagliotti Vigil;Santa Catarina
2781747995973774;Diego Luis Kreutz;Universidade Federal do Amazonas, UFAM, Brasil.;2781747995973774;Diego Luis Kreutz;Amazonas
8792400749259477;Marco Aurelio Amaral Henriques;Universidade Estadual de Campinas, UNICAMP, Brasil.;8792400749259477;Marco Aurelio Amaral Henriques;São Paulo
1246085373474860;Katyusco de Farias Santos;Instituto Federal de Educação, Ciência e Tecnologia da Paraíba - IFPB, IFPB, Brasil.;1246085373474860;Katyusco de Farias Santos;Paraíba
4445790203781215;Luiz Eduardo Teixeira Brandão;Pontifícia Universidade Católica do Rio de Janeiro, PUC-Rio, Brasil.;4445790203781215;Luiz Eduardo Teixeira Brandão;Rio de Janeiro
0658814862350187;Ricardo Ratner Rochman;Fundação Getulio Vargas - SP, FGV-SP, Brasil.;658814862350187;Ricardo Ratner Rochman;São Paulo
9038113331816861;Ewerton Rodrigues Andrade;Fundação Universidade Federal de Rondônia, UNIR, Brasil.;9038113331816861;Ewerton Rodrigues Andrade;Rondônia
3321577431881283;Tales Cleber Pimenta;Universidade Federal de Itajubá, UNIFEI, Brasil.;272608028854633;Tales Cleber Pimenta;Minas Gerais
0638632787682079;Paulo Caetano da Silva;Universidade Salvador, UNIFACS, Brasil.;638632787682079;Paulo Caetano da Silva;Bahia
0122916218414168;Roderval Marcelino;Universidade Federal de Santa Catarina, UFSC, Brasil.;122916218414168;Roderval Marcelino;Santa Catarina
8623512462352869;Antônio Marcos Alberti;Instituto Nacional de Telecomunicações, INATEL, Brasil.;8623512462352869;Antônio Marcos Alberti;Distrito Federal
5220976485878526;Luli Radfahrer;Universidade de São Paulo, USP, Brasil.;5220976485878526;Luli Radfahrer;São Paulo
2212288622038633;Patrícia Vilain;Universidade Federal de Santa Catarina, UFSC, Brasil.;2212288622038633;Patrícia Vilain;Santa Catarina
1058846722790485;Cinthia Obladen de Almendra Freitas;Pontifícia Universidade Católica do Paraná, PUC/PR, Brasil.;1058846722790485;Cinthia Obladen de Almendra Freitas;Paraná
0120615995402345;Fabíola Gonçalves Pereira Greve;Universidade Federal da Bahia, UFBA, Brasil.;120615995402345;Fabíola Gonçalves Pereira Greve;Bahia
4664874328682497;Gesiane Silveira Pereira;Universidade Vila Velha, UVV, Brasil.;3755692723547807;Gesiane Silveira Pereira;Amapá
0494751833227700;Alvaro Machado Dias;Universidade Federal de São Paulo, UNIFESP, Brasil.;494751833227700;Alvaro Machado Dias;São Paulo
8321834215728086;Paula De Camargo Fiorini;Universidade Estadual Paulista Júlio de Mesquita Filho, UNESP, Brasil.;8321834215728086;Paula De Camargo Fiorini;Pernambuco
6123253784997703;Fernanda da Silva Momo;Universidade Federal do Rio Grande do Sul, UFRGS, Brasil.;6123253784997703;Fernanda da Silva Momo;Rio Grande do Sul
6392597835724138;Fabricia Carneiro Roos Frantz;Universidade Regional do Noroeste do Estado do Rio Grande do Sul, UNIJUI, Brasil.;3644027876437753;Fabricia Carneiro Roos Frantz;Rio Grande do Sul
6136685270563354;Moacir Godinho Filho;Universidade Federal de São Carlos, UFSCAR, Brasil.;9062191157466610;Moacir Godinho Filho;São Paulo
4842733764531027;Fabiano Passuelo Hessel;Pontifícia Universidade Católica do Rio Grande do Sul, PUCRS, Brasil.;4842733764531027;Fabiano Passuelo Hessel;Rio Grande do Sul
7221869481508890;Filippe Coury Jabour Neto;Instituto Federal do Sudeste de Minas Gerais, IF SUDESTE MG, Brasil.;7221869481508890;Filippe Coury Jabour Neto;Minas Gerais
2880668102587861;Leonardo Oliveira Moreira;Universidade Federal do Ceará, UFC, Brasil.;2880668102587861;Leonardo Oliveira Moreira;Ceará
7926838249921187;Marcelo Damasceno de Melo;Instituto Federal de Educação, Ciência e Tecnologia do Rio Grande do Norte, IFRN, Brasil.;7926838249921187;Marcelo Damasceno de Melo;Rio Grande do Norte
3322414202275652;Eduardo de Senzi Zancul;Universidade de São Paulo, USP, Brasil.;3322414202275652;Eduardo de Senzi Zancul;São Paulo
9858319665065036;Juliano Araujo Wickboldt;Universidade Federal do Rio Grande do Sul, UFRGS, Brasil.;9858319665065036;Juliano Araujo Wickboldt;Rio Grande do Sul
5103490322445619;Eduardo de Freitas Rocha Loures;Pontifícia Universidade Católica do Paraná, PUC/PR, Brasil.;5103490322445619;Eduardo de Freitas Rocha Loures;Paraná
8470815792470938;Leonardo Elizeire Bremermann;Universidade Federal de Santa Catarina, UFSC, Brasil.;8730750961111658;Leonardo Elizeire Bremermann;Santa Catarina
6820830740393500;Vicente Ferreira de Lucena Junior;Universidade Federal do Amazonas, UFAM, Brasil.;6820830740393500;Vicente Ferreira de Lucena Junior;Amazonas
5572669840008569;Anderson Luis Szejka;Pontifícia Universidade Católica do Paraná, PUC/PR, Brasil.;5572669840008569;Anderson Luis Szejka;Paraná
5422276244335274;Jorge Ferreira da Silva;Pontifícia Universidade Católica do Rio de Janeiro, PUC-Rio, Brasil.;7224163454715504;Jorge Ferreira da Silva;Rio de Janeiro
6301625161386664;Luciana Backes;Universidade La Salle - Canoas, UNILASALLE, Brasil.;5877338921329207;Luciana Backes;Rio Grande do Sul
5877338921329207;Ana Margô Mantovani;Universidade La Salle - Canoas, UNILASALLE, Brasil.;5877338921329207;Ana Margô Mantovani;Rio Grande do Sul
3402056676199307;Carlos Pernisa Júnior;Universidade Federal de Juiz de Fora, UFJF, Brasil.;3402056676199307;Carlos Pernisa Júnior;Minas Gerais
8100404916721779;Katia Augusta Maciel;Universidade Federal do Rio de Janeiro, UFRJ, Brasil.;8100404916721779;Katia Augusta Maciel;Rio de Janeiro
9933939386282163;Luís Carlos Petry;Pontifícia Universidade Católica de São Paulo, PUC/SP, Brasil.;9933939386282163;Luís Carlos Petry;São Paulo
2530535838251633;Érico Marcelo Hoff do Amaral;Universidade Federal do Pampa, UNIPAMPA, Brasil.;501764855693100;Érico Marcelo Hoff do Amaral;Rio Grande do Sul
1736294295596552;Laura Graziela Figueiredo Fernandes Gomes;Universidade Federal de Santa Maria, UFSM, Brasil.;1736294295596552;Laura Graziela Figueiredo Fernandes Gomes;Rio Grande do Sul
9716270626654261;Francisco Petrônio Alencar de Medeiros;Instituto Federal de Educação, Ciência e Tecnologia da Paraíba - IFPB, IFPB, Brasil.;9716270626654261;Francisco Petrônio Alencar de Medeiros;Paraíba
0683836610965593;Flávia Doná;Universidade Federal de São Paulo, UNIFESP, Brasil.;2468514648565776;Flavia Dona;São Paulo
0824508932634550;Elvis Terci Valera;Universidade de São Paulo, USP, Brasil.;824508932634550;Elvis Terci Valera;São Paulo
8576347873975306;Germano Bruno Afonso;Centro Universitário Internacional, UNINTER, Brasil.;8576347873975306;Germano Bruno Afonso;Distrito Federal
4448248613510170;Mônia Aparecida da Silva;Universidade Federal de São João Del-Rei, UFSJ, Brasil.;4448248613510170;Mônia Aparecida da Silva;Pernambuco
1280835655867163;Eduardo da Silva Lopes;Universidade Estadual do Centro-Oeste, UNICENTRO, Brasil.;1280835655867163;Eduardo da Silva Lopes;Paraná
7471848591836966;Alexandre Carvalho Silva;Instituto Federal Goiano - campus Morrinhos, IFGOIANO, Brasil.;7471848591836966;Alexandre Carvalho Silva;Goiás
9801802525566177;Jose Aquiles Baesso Grimoni;Universidade de São Paulo, USP, Brasil.;9801802525566177;Jose Aquiles Baesso Grimoni;São Paulo
2141124649915751;Pasqualino Romano Magnavita;Universidade Federal da Bahia, UFBA, Brasil.;2141124649915751;Pasqualino Romano Magnavita;Bahia
9627705064505983;Leonardo César Carvalho;Universidade Federal de Alfenas, UNIFAL/MG, Brasil.;9627705064505983;Leonardo César Carvalho;Minas Gerais
1790662929908503;Luciene Chagas de Oliveira;Universidade de Uberaba, UNIUBE, Brasil.;1790662929908503;Luciene Chagas de Oliveira;Minas Gerais
0695899382782312;Sergio Scheer;Universidade Federal do Paraná, UFPR, Brasil.;8615127367466231;Sergio Scheer;Paraná
7390573927636069;Silvana Aparecida Borsetti Gregorio Vidotti;Universidade Estadual Paulista Júlio de Mesquita Filho, UNESP, Brasil.;7390573927636069;Silvana Aparecida Borsetti Gregorio Vidotti;Pernambuco
1611789402968312;Marcia Pasin;Universidade Federal de Santa Maria, UFSM, Brasil.;1611789402968312;Marcia Pasin;Rio Grande do Sul
3270615314717988;Ricardo Mendes Leal Neto;Universidade de São Paulo, USP, Brasil.;3270615314717988;Ricardo Mendes Leal Neto;São Paulo
1728783224542391;Irla Bocianoski Rebelo;Centro Universitário UNIEURO, UNIEURO, Brasil.;1728783224542391;Irla Bocianoski Rebelo;Distrito Federal
2980425786626151;Raul Antonino Feijóo;Laboratório Nacional de Computação Científica, LNCC, Brasil.;2603863331633089;Raul Antonino Feijoó;Rio de Janeiro
0302161120707813;Cristina Jasbinschek Haguenauer;Universidade Federal do Rio de Janeiro, UFRJ, Brasil.;302161120707813;Cristina Jasbinschek Haguenauer;Rio de Janeiro
5194203867111923;Mercedes Rocío Gonzales Márquez;Universidade Estadual de Mato Grosso do Sul, UEMS, Brasil.;5194203867111923;Mercedes Rocío Gonzales Márquez;Mato Grosso
7546749502855942;Maicon Gouvea de Oliveira;Escola de Engenharia de São Carlos da Universidade de São Paulo, EESC-USP, Brasil.;7546749502855942;Maicon Gouvea de Oliveira;São Paulo
6602607106117942;Marcelo Anderson Bracht;Fundação Universidade Regional de Blumenau, FURB, Brasil.;6602607106117942;Marcelo Anderson Bracht;Santa Catarina
2993264661694458;Luciana Maria dos Reis;Universidade Federal de Alfenas, UNIFAL/MG, Brasil.;4852992975865513;Luciana Maria dos Reis;Minas Gerais
5340609373784793;Adriana Teresa Silva Santos;Universidade Federal de Alfenas, UNIFAL/MG, Brasil.;4852992975865513;Adriana Teresa Silva;Minas Gerais
6222978572011439;Arnaldo Aires Peixoto Junior;Centro Universitário Christus, UNICHRISTUS, Brasil.;6222978572011439;Arnaldo Aires Peixoto Junior;Ceará
9169095482512290;Marilia Miranda Forte Gomes;Universidade de Brasília, UnB, Brasil.;9169095482512290;Marilia Miranda Forte Gomes;Distrito Federal
2563935738990997;Camila Palhares Teixeira;Universidade Estadual de Minas Gerais, UEMG, Brasil.;2563935738990997;Camila Palhares Teixeira;Minas Gerais
1829333800490851;Rosa Maria Esteves Moreira da Costa;Universidade do Estado do Rio de Janeiro, UERJ, Brasil.;7535348349141535;Rosa Maria Esteves Moreira da Costa;Rio de Janeiro
0048790978449306;Avanilde Kemczinski;Universidade do Estado de Santa Catarina, UDESC, Brasil.;48790978449306;Avanilde Kemczinski;Santa Catarina
9329438229733907;Manoel Ribeiro Filho;Universidade Federal do Sul e Sudeste do Pará, UNIFESSPA, Brasil.;9329438229733907;Manoel Ribeiro Filho;Pará
3447520409510736;Anderson Maciel;Universidade Federal do Rio Grande do Sul, UFRGS, Brasil.;294302345865267;Anderson Maciel;Rio Grande do Sul
1168989222280325;Antônio Carlos de Abreu Mól;Centro Universitário Carioca, UNICARIOCA, Brasil.;1168989222280325;Antônio Carlos de Abreu Mól;Rio de Janeiro
4210677630165565;Ana Paula Legey de Siqueira;Centro Universitário Carioca, UNICARIOCA, Brasil.;1168989222280325;SIQUEIRA, ANA PAULA LEGEY DE;Rio de Janeiro
8343393957854863;Adriano Anunciação Oliveira;Universidade Federal do Ceará, UFC, Brasil.;8343393957854863;Adriano Anunciação Oliveira;Ceará
2631933490596587;Antonia Arisdélia Fonseca Matias Aguiar Feitosa;Universidade Federal da Paraíba, UFPB, Brasil.;2631933490596587;Antonia Arisdélia Fonseca Matias Aguiar Feitosa;Paraíba
8486882484125774;Paulo Victor Rodrigues de Carvalho;Universidade Federal do Rio de Janeiro, UFRJ, Brasil.;8486882484125774;Paulo Victor Rodrigues de Carvalho;Rio de Janeiro
9984314744370920;Laura de Sousa Gomes Veloso;Faculdades de Enfermagem Nova Esperança, FACENE, Brasil.;9984314744370920;Laura de Sousa Gomes Veloso;Paraíba
1158798915256133;Christus Menezes da Nobrega;Universidade Aberta do Brasil, UAB, Brasil.;727171902745709;Christus Menezes;Mato Grosso
2035754554780009;Nelci Adriana Cicuto Ferreira Rocha;Universidade Federal de São Carlos, UFSCAR, Brasil.;2278152516658626;Nelci Adriana Cicuto Ferreira Rocha;São Paulo
3262681213088048;Isabela Gasparini;Universidade do Estado de Santa Catarina, UDESC, Brasil.;2259041691301555;Isabela Gasparini;Santa Catarina
0155109382883894;Elizeu Batista Borloti;Universidade Federal do Espírito Santo, UFES, Brasil.;1726041421275880;Elizeu Batista Borloti;Espírito Santo
1726041421275880;Verônica Bender Haydu;Universidade Estadual de Londrina, UEL, Brasil.;1726041421275880;Verônica Bender Haydu;Paraná
8964123297688432;Regina Borges de Araujo;Universidade Federal de São Carlos, UFSCAR, Brasil.;8964123297688432;Regina Borges de Araujo;São Paulo
5144730275745518;Fátima Nelsizeuma Sombra de Medeiros;Universidade Federal de São Paulo, UNIFESP, Brasil.;6069717038105786;Fátima N. Sombra de Medeiros;São Paulo
4437947315163588;Camila Torriani-Pasin;Universidade de São Paulo, USP, Brasil.;4437947315163588;Camila Torriani-Pasin;São Paulo
2081849934383112;Elizabel de Souza Ramalho Viana;Universidade Federal do Rio Grande do Norte, UFRN, Brasil.;3250319979361307;Elizabel de Souza Ramalho Viana;Rio Grande do Norte
6553900966729412;Silvana Maria Blascovi de Assis;Universidade Presbiteriana Mackenzie, MACKENZIE, Brasil.;1678715490240349;Silvana Maria Blascovi de Assis;São Paulo
1973691273575100;Andromeda Goretti de Menezes Campos;Instituto Federal de Educação, Ciência e Tecnologia do Espírito Santo, IFES, Brasil.;1973691273575100;Andromeda Goretti de Menezes Campos;Espírito Santo
7091513065379000;Renato da Veiga Guadagnin;Universidade Católica de Brasília, UCB/DF, Brasil.;9190489069187153;Renato Guadagnin;Distrito Federal
9190489069187153;Lourdes Mattos Brasil;Universidade de Brasília - Faculdade UnB-Gama, FGA, Brasil.;9190489069187153;Lourdes Mattos Brasil;Distrito Federal
8415486629956081;Edgar Silveira Franco;Universidade Federal de Goiás, UFG, Brasil.;8415486629956081;Edgar Silveira Franco;Goiás
1166337759206783;Denise Azevedo Duarte Guimarães;Universidade Tuiuti do Paraná, UTP, Brasil.;1166337759206783;Denise Azevedo Duarte Guimarães;Paraná
9998552952567661;Jairo Simao Santana Melo;Serviço Nacional de Aprendizagem Comercial - DF, SENAC/DF, Brasil.;9499042601643906;Jairo Simão Santana Melo;Distrito Federal
3010497094377497;Rafael Rieder;Universidade de Passo Fundo, UPF, Brasil.;3682660634268734;Rafael Rieder;Rio Grande do Sul
4744515106232644;José Roberto Pereira Lauris;Universidade de São Paulo, USP, Brasil.;4744515106232644;José Roberto Pereira Lauris;São Paulo
9437079385922873;Ruth Caldeira de Melo;Universidade de São Paulo, USP, Brasil.;9437079385922873;Ruth Caldeira de Melo;São Paulo
3523652954816663;Eduardo Marques Arantes;Universidade Federal de Minas Gerais, UFMG, Brasil.;3523652954816663;Eduardo Marques Arantes;Minas Gerais
4760598240322592;João Vitor Gobis Verges;Instituto Federal de Educação, Ciência e Tecnologia do Rio Grande do Sul, IFRS, Brasil.;4760598240322592;João Vitor Gobis Verges;Rio Grande do Sul
2445144539614697;Arlinda Cantero Dorsa;Universidade Católica Dom Bosco, UCDB, Brasil.;2445144539614697;Arlinda Cantero Dorsa;Mato Grosso do Sul
9337143918677200;Thais Helena Chaves de Castro;Universidade Federal do Amazonas, UFAM, Brasil.;5919189481858271;Thaís Helena Chaves de Castro;Amazonas
4921640978892287;Maria Guiomar Carneiro Tommasiello;Universidade Metodista de Piracicaba, UNIMEP, Brasil.;4921640978892287;Maria Guiomar Carneiro Tommasiello;São Paulo
8383022780236277;Heloisa Helena Oliveira Buarque de Hollanda;Universidade Federal do Rio de Janeiro, UFRJ, Brasil.;5029016161874169;Heloisa Buarque de Hollanda;Rio de Janeiro
