CoordenadorID;Nome;Afiliacao;RefID;RefNome;Estado
3355338790654065;Veronica Teichrieb;Universidade Federal de Pernambuco, UFPE, Brasil.;4321649532287831;Verônica Teichrieb;Pernambuco
7532050172035129;Judith Kelner;Universidade Federal de Pernambuco, UFPE, Brasil.;4321649532287831;Judith Kelner;Pernambuco
0649930882307115;Francisco Carlos de Mattos Brito Oliveira;Universidade Estadual do Ceará, UECE, Brasil.;649930882307115;Francisco Carlos de Mattos Brito Oliveira;Ceará
8901320181295016;Romero Tori;Universidade de São Paulo, USP, Brasil.;813823100105934;Romero Tori;São Paulo
4340581249924621;Rosa Monteiro Paulo;Universidade Estadual Paulista Júlio de Mesquita Filho, UNESP, Brasil.;4340581249924621;Rosa Monteiro Paulo;Pernambuco
4794107935753176;Alvaro Joao Magalhaes de Queiroz;Universidade Federal de Juiz de Fora, UFJF, Brasil.;4794107935753176;Alvaro Joao Magalhaes de Queiroz;Minas Gerais
3767009717402045;Alexandre Cardoso;Universidade Federal de Uberlândia, UFU, Brasil.;3767009717402045;Alexandre Cardoso;Minas Gerais
9801031941805250;Alcimar Barbosa Soares;Universidade Federal de Uberlândia, UFU, Brasil.;9801031941805250;Alcimar Barbosa Soares;Minas Gerais
4006878042502781;Andre Schneider de Oliveira;Universidade Tecnológica Federal do Paraná, UTFPR, Brasil.;4006878042502781;Andre Schneider de Oliveira;Paraná
4791589931798048;Esteban Walter Gonzalez Clua;Universidade Federal Fluminense, UFF, Brasil.;4791589931798048;Esteban Walter Gonzalez Clua;Rio de Janeiro
3191129244573056;Sandro Roberto Fernandes;Instituto Federal do Sudeste de Minas Gerais, IF SUDESTE MG, Brasil.;3191129244573056;Sandro Roberto Fernandes;Minas Gerais
0584425766553916;Giovanna Graziosi Casimiro;Laboratório de Arte contemporanea, Tecnolodia e Mídias Digitias, LABART, Brasil.;584425766553916;Giovanna Graziosi Casimiro;Rio Grande do Sul
6001559184049370;Mirella de Medeiros Misi;Universidade Federal da Bahia, UFBA, Brasil.;6001559184049370;Mirella de Medeiros Misi;Bahia
3827444548540732;Adilson Vahldick;Universidade do Estado de Santa Catarina, UDESC\CEAVI, Brasil.;3827444548540732;Adilson Vahldick;Santa Catarina
0110284367744326;Edson Roberto Minatel;Ablevision Sistemas Computacionais Ltda, ABLEVISION, Brasil.;9844015070032232;Edson Minatel;São Paulo
0992498795960159;Eunice Pereira dos Santos Nunes;Universidade Aberta do Brasil, UAB, Brasil.;8064558616443413;Eunice Pereira dos Santos Nunes;Mato Grosso
4186515742605446;Victor Hugo Costa de Albuquerque;Universidade Federal do Ceará, UFC, Brasil.;4186515742605446;Victor Hugo Costa de Albuquerque;Ceará
0116830050245232;Paulo Roberto Boa Sorte Silva;Universidade Federal de Sergipe, UFS, Brasil.;116830050245232;Paulo Roberto Boa Sorte Silva;Sergipe
5458829100371043;Regina Coeli Ruschel;Universidade Estadual de Campinas, UNICAMP, Brasil.;409865244128616;Regina Coeli Ruschel;São Paulo
4465619366143200;Mylene Christine Queiroz de Farias;Universidade de Brasília, UnB, Brasil.;4465619366143200;Mylene Christine Queiroz de Farias;Distrito Federal
2259041691301555;Marcelo da Silva Hounsell;Universidade do Estado de Santa Catarina, UDESC, Brasil.;48790978449306;Marcelo da Silva Hounsell;Santa Catarina
6620664028434195;Luis Fernando Soares;Universidade Federal de São João Del-Rei, UFSJ, Brasil.;4611623889620565;Luis Fernando Soares;Pernambuco
2413369452452350;Liz Carmem Silva-Pereira;Instituto Federal de Educação, Ciência e Tecnologia do Pará, Campus Itaitub, IFPA, Brasil.;2413369452452350;Liz Carmem Silva-Pereira;Pará
1584574231456379;Breno Maciel Souza Reis;Universidade Federal do Rio Grande do Sul, UFRGS, Brasil.;1584574231456379;Breno Maciel Souza Reis;Rio Grande do Sul
3860172079417937;Adriane Borda Almeida da Silva;Universidade Federal de Pelotas, UFPEL, Brasil.;7229833456758124;Adriane Borda Almeida da SIlva;Rio Grande do Sul
6495915655298176;Adriana Gomes Alves;Universidade do Vale do Itajaí, UNIVALI, Brasil.;6495915655298176;Adriana Gomes Alves;Santa Catarina
3196052576107598;Saul Emanuel Delabrida Silva;University of South Australia, UNISA, Austrália.;3196052576107598;Saul Emanuel Delabrida Silva;
6817254319412151;Polise Moreira De Marchi;Fundação Armando Álvares Penteado, FAAP, Brasil.;6817254319412151;Polise Moreira De Marchi;São Paulo
6919473605146182;Fabio Pinto da Silva;Universidade Federal do Rio Grande do Sul, UFRGS, Brasil.;6919473605146182;Fabio Pinto da Silva;Rio Grande do Sul
5734518155680206;Mariana Pohlmann de Oliveira;Universidade Federal do Rio Grande do Sul, UFRGS, Brasil.;6919473605146182;Mariana Pohlmann de Oliveira;Rio Grande do Sul
2746290295878975;Kate Mamhy Oliveira Kumada;Universidade Federal do ABC, UFABC, Brasil.;2746290295878975;Kate Mamhy Oliveira;São Paulo
5123696681613759;Tania Rossi Garbin;Universidade Federal de Ouro Preto, UFOP, Brasil.;8362852284802251;Tânia Rossi Garbin;Minas Gerais
2343273642042806;Márcia Regina de Freitas;UNESP Guaratinguetá, FEG, Brasil.;2343273642042806;Márcia Regina de Freitas;São Paulo
5391034042353187;Eliane Schlemmer;Universidade Aberta de Portugal, UAB-PORTUGAL, Portugal.;1572779834379796;Eliane Schlemmer;
3381049256541106;Marcelo Gitirana Gomes Ferreira;Universidade do Vale do Itajaí, UNIVALI, Brasil.;3381049256541106;Marcelo Gitirana Gomes Ferreira;Santa Catarina
2125238602476950;Simone Keller Füchter;Faculdade Estacio de Sa, ESTACIO, Brasil.;2125238602476950;Simone Keller Füchter;Rio de Janeiro
1744732999336375;Windson Viana de Carvalho;Universidade Federal do Ceará, UFC, Brasil.;1744732999336375;Windson Viana de Carvalho;Ceará
0453892715674953;Flávio de Barros Vidal;Universidade de Brasília, UnB, Brasil.;453892715674953;Flávio de Barros Vidal;Distrito Federal
8243001226255815;Pablo Alexandre Gobira de Souza Ricardo;Universidade do Estado de Minas Gerais, UEMG, Brasil.;8243001226255815;Pablo Alexandre Gobira de Souza Ricardo;Minas Gerais
9999217523842385;Eliane Pozzebon;Universidade Federal de Santa Catarina, UFSC, Brasil.;9999217523842385;Eliane Pozzebon;Santa Catarina
8655724197142007;Josete Mazon;Universidade Federal de Santa Catarina, UFSC, Brasil.;9999217523842385;Josete Mazon;Santa Catarina
0326014908040698;Renata Lacerda Caldas;Instituto Federal Fluminense, IFF, Brasil.;326014908040698;Renata Lacerda Caldas;Rio de Janeiro
0141389002346917;Rejane Caetano Augusto Cantoni;Programa de Posgrado Online en Artes Mediales, PPOAM, Argentina.;141389002346917;Rejane Caetano Augusto Cantoni;
1882712230914196;Antonio Carlos Sementille;Universidade Estadual Paulista Júlio de Mesquita Filho, UNESP, Brasil.;8626964624628522;Antonio Carlos Sementille;Pernambuco
3554024776201116;Liliane da Silva Coelho Jacon;Universidade Federal de Rondônia, UNIR, Brasil.;3554024776201116;Liliane da Silva Coelho Jacon;Rondônia
6165964080419504;Josyanne Pinto Giesta;Instituto Federal de Educação, Ciência e Tecnologia do Rio Grande do Norte, IFRN, Brasil.;6165964080419504;Josyanne Pinto Giesta;Rio Grande do Norte
8487981600635230;Cesar Reis;Universidade Federal de Viçosa, UFV, Brasil.;152834093913136;César Reis;Minas Gerais
1553616454067748;César Imai;Universidade Estadual de Londrina, UEL, Brasil.;4778641486908033;CÉSAR IMAI;Paraná
7143571029793493;Stephanie Kamarry Alves de Sousa;Instituto Federal de Sergipe, IFS, Brasil.;7143571029793493;Stephanie Kamarry Alves de Sousa;Sergipe
5515322256604194;Marcio Augusto Reolon Schmidt;Universidade Federal de Uberlândia, UFU, Brasil.;5515322256604194;Marcio Augusto Reolon Schmidt;Minas Gerais
5752128941340564;Edgar Roberto Kirchof;Universidade Luterana do Brasil, ULBRA, Brasil.;5752128941340564;Edgar Roberto Kirchof;Rio Grande do Sul
7887916265742855;Glaucia Nolasco de Almeida Mello;Pontifícia Universidade Católica de Minas Gerais, PUC Minas, Brasil.;7887916265742855;Glaucia Nolasco de Almeida Mello;Minas Gerais
6813786273390182;Tales Nereu Bogoni;Universidade Estadual de Mato Grosso, UNEMAT, Brasil.;3010497094377497;Tales Nereu Bogoni;Mato Grosso
9405118016902400;Edna de Mello Silva;Universidade Federal de São Paulo, UNIFESP, Brasil.;9405118016902400;Edna de Mello Silva;São Paulo
5998752909180697;Alyson de Jesus dos Santos;Instituto Federal de Educação, Ciência e Tecnologia do Amazonas, IFAM, Brasil.;5998752909180697;Alyson de Jesus dos Santos;Amazonas
3122373875381348;Larissa Cristina Cruz Brum;Instituto Federal Fluminense, IFF, Brasil.;3122373875381348;Larissa Cristina Cruz Brum;Rio de Janeiro
4226175401428037;Mônica Rocha Ferreira de Oliveira;Universidade do Estado de Minas Gerais, UEMG, Brasil.;4226175401428037;Mônica Rocha Ferreira de Oliveira;Minas Gerais
1934903225521860;Francisco Madeiro Bernardino Junior;Universidade Católica de Pernambuco, UNICAP, Brasil.;1934903225521860;Francisco Madeiro Bernardino Junior;Pernambuco
0148962230603842;Marcus Vinícius Liessem Fontana;Universidade Federal da Fronteira Sul, UFFS, Brasil.;148962230603842;Marcus Vinícius Liessem Fontana;Santa Catarina
2087785677186785;Isabel Dillmann Nunes;Universidade Federal do Rio Grande do Norte, UFRN, Brasil.;2087785677186785;Isabel Dillmann Nunes;Rio Grande do Norte
4394162331037750;Alberto Barbosa Raposo;Pontifícia Universidade Católica do Rio de Janeiro, PUC-Rio, Brasil.;4394162331037750;Alberto Barbosa Raposo;Rio de Janeiro
3309342336039521;Ney Laert Vilar Calazans;Conselho Nacional de Desenvolvimento Científico e Tecnológico, CNPq, Brasil.;4394162331037750;Ney Calazans;Distrito Federal
1900481113982922;Raphael Pereira de Oliveira;Universidade Federal de Sergipe, UFS, Brasil.;1900481113982922;Raphael Pereira de Oliveira;Sergipe
0555490225765351;Sergio da Costa Nunes;Instituto Federal de Educação Ciência e Tecnologia Sul-rio-grandense, IFSUL, Brasil.;555490225765351;Sergio da Costa Nunes;Rio Grande do Sul
9202801399600456;Jorge Antonio Silva Centeno;Universidade Federal do Paraná, UFPR, Brasil.;9202801399600456;Jorge Antonio Silva Centeno;Paraná
8795066026611788;Maurício José Laguardia Campomori;Universidade Federal de Minas Gerais, UFMG, Brasil.;8795066026611788;Maurício José Laguardia Campomori;Minas Gerais
8933624812566216;Ingrid Winkler;SENAI - Departamento Regional da Bahia, SENAI/DR/BA, Brasil.;5034444360451621;Ingrid Winkler;Bahia
9756167788721062;Nelson Cruz Sampaio Neto;Universidade Federal do Pará, UFPA, Brasil.;9756167788721062;Nelson Cruz Sampaio Neto;Pará
9163421021115381;Maria Cristiane Barbosa Galvão;Universidade de São Paulo, USP, Brasil.;9163421021115381;Maria Cristiane Barbosa Galvão;São Paulo
0159010164759435;Marcelo Almeida Bairral;Universidade Federal Rural do Rio de Janeiro, UFRRJ, Brasil.;4340581249924621;Marcelo Almeida Bairral;Rio de Janeiro
4313837720967509;Renato Francisco Merli;Universidade Tecnológica Federal do Paraná, UTFPR, Brasil.;4313837720967509;Renato Francisco Merli;Paraná
2029488267292298;Breno de Paula Andrade Cruz;Universidade Federal do Rio de Janeiro, UFRJ, Brasil.;2029488267292298;Breno de Paula Andrade Cruz;Rio de Janeiro
2479982770095588;Daniel de Carvalho Moreira;Universidade Estadual de Campinas, UNICAMP, Brasil.;2479982770095588;Daniel de Carvalho Moreira;São Paulo
9719247117370600;Claudia Maria Lima Werner;Universidade Federal do Rio de Janeiro, UFRJ, Brasil.;9719247117370600;Claudia Maria Lima Werner;Rio de Janeiro
6162308583288053;Rosângela Alves Pereira;Universidade Federal do Rio de Janeiro, UFRJ, Brasil.;9719247117370600;Rosangela Alves Pereira;Rio de Janeiro
8479082398514293;Marcelo Becker;Escola de Engenharia de São Carlos Universidade de São Paulo, EESC - USP, Brasil.;8479082398514293;Marcelo Becker;São Paulo
8630348977498378;Felipe Barreto Campelo Cruz;Universidade Tecnológica Federal do Paraná, UTFPR, Brasil.;8630348977498378;Felipe Barreto Campelo Cruz;Paraná
0277705848688464;Claudio Kirner;Universidade Federal de Itajubá, UNIFEI, Brasil.;277705848688464;Claudio Kirner;Minas Gerais
4019150313777291;Paulo Eigi Miyagi;Instituto de Pesquisas Tecnológicas do Estado de São Paulo, IPT, Brasil.;4185679659611455;Paulo Eigi Miyagi;São Paulo
4185679659611455;Jun Okamoto Junior;Universidade de São Paulo, USP, Brasil.;4185679659611455;Jun Okamoto Junior;São Paulo
0521761025000380;Cléber Gimenez Corrêa;Universidade Tecnológica Federal do Paraná, UTFPR, Brasil.;521761025000380;Cléber Gimenez Corrêa;Paraná
8718817544368644;Fabio de Souza Alves;Instituto Federal de Santa Catarina, IFSC, Brasil.;8718817544368644;Fabio de Souza Alves;Santa Catarina
1592443578418038;Rosangela da Silva Leote;Universidade Estadual Paulista Júlio de Mesquita Filho, UNESP, Brasil.;1592443578418038;Rosangela da Silva Leote;Pernambuco
0878410768350416;Liane Margarida Rockenbach Tarouco;Universidade Federal do Rio Grande do Sul, UFRGS, Brasil.;878410768350416;Liane Margarida Rockenbach Tarouco;Rio Grande do Sul
0412919715126909;Fernando Selleri Silva;Universidade do Estado de Mato Grosso, UNEMAT, Brasil.;412919715126909;Fernando Selleri Silva;Mato Grosso
7514305376858192;Luciano Silva;Universidade Cruzeiro do Sul, UNICSUL, Brasil.;7514305376858192;Luciano Silva;Acre
5925784315354434;Clicéres Mack Dal Bianco;Universidade Regional Integrada do Alto Uruguai e das Missões, URI, Brasil.;5925784315354434;Clicéres Mack Dal Bianco;Minas Gerais
9911012866860858;Filipe Pereira Mesquita dos Santos;Instituto Federal de Educação, Ciência e Tecnologia do Rio de Janeiro, IFRJ, Brasil.;9911012866860858;Filipe Pereira Mesquita dos Santos;Rio de Janeiro
0194528219787423;Rosaria Ono;Universidade de São Paulo, USP, Brasil.;8516604648327493;Rosaria Ono;São Paulo
5057165446370629;Heliana Bezerra Soares;Universidade Federal do Rio Grande do Norte, UFRN, Brasil.;4440595486888973;Heliana Bezerra Soares;Rio Grande do Norte
4731132112733505;Adinovan Henriques de Macedo Pimenta;Centro Universitário Adventista de São Paulo, UNASP, Brasil.;4731132112733505;Adinovan Henriques de Macedo Pimenta;São Paulo
4571544548251124;Victor Gonçalves Gloria Freitas;S B I, UCAM, Brasil.;4571544548251124;Victor Gonçalves Gloria Freitas;Rio de Janeiro
0618509402775224;Márcio Minto Fabricio;Universidade de São Paulo, USP, Brasil.;3684061144624450;Márcio Minto Fabrício;São Paulo
0271672292477578;Marcelo Knörich Zuffo;Universidade de São Paulo, USP, Brasil.;1562357566810393;Marcelo Knorich Zuffo;São Paulo
1402289786010170;Antônio Pereira Júnior;Universidade Federal do Pará, UFPA, Brasil.;1402289786010170;Antônio Pereira Júnior;Pará
2704085730058906;Ana Lúcia Nogueira de Camargo Harris;Universidade Estadual de Campinas, UNICAMP, Brasil.;2704085730058906;Ana Lúcia Nogueira de Camargo Harris;São Paulo
5938003791536092;Rosinei Batista Ribeiro;Centro Universitário Teresa D' Ávila, UNIFATEA, Brasil.;5938003791536092;Rosinei Batista Ribeiro;São Paulo
9016360553400035;Maria Lencastre Pinheiro de Menezes Cruz;Universidade de Pernambuco, UPE, Brasil.;9016360553400035;Maria Lencastre Pinheiro de Menezes Cruz;Pernambuco
6602202569381703;Luciano Denardin de Oliveira;Pontifícia Universidade Católica do Rio Grande do Sul, PUCRS, Brasil.;6602202569381703;Luciano Denardin de Oliveira;Rio Grande do Sul
9907691146700229;Márcio Antônio Duarte;Universidade Federal de Goiás, UFG, Brasil.;9907691146700229;Márcio Antônio Duarte;Goiás
1538338871689655;Cláudio Rosito Jung;Universidade Federal do Rio Grande do Sul, UFRGS, Brasil.;1538338871689655;Cláudio Rosito Jung;Rio Grande do Sul
8057011287660102;Maria Alice Grigas Varella Ferreira;Universidade de São Paulo, USP, Brasil.;8057011287660102;Maria Alice Grigas Varella Ferreira;São Paulo
4754106250302979;Daniel Lima Gomes Júnior;Instituto Federal do Maranhão, IFMA, Brasil.;4754106250302979;Daniel Lima Gomes Júnior;Maranhão
1520994716359117;Ivana Marcia Oliveira Maia;(CNPq) Conselho Nacional de Desenvolvimento Científico e Tecnológico.;4754106250302979;IVANA MÁRCIA  OLIVEIRA MAIA;Distrito Federal
1974791787566027;Mauricio Marengoni;Universidade Presbiteriana Mackenzie, MACKENZIE, Brasil.;1974791787566027;Mauricio Marengoni;São Paulo
0346488880579660;Nivea Gabriela Benevides de Albuquerque;Universidade Federal do Pará, UFPA, Brasil.;346488880579660;Nivea Gabriela Benevides de Albuquerque;Pará
1734032782594771;Hugo Fuks;Pontifícia Universidade Católica do Rio de Janeiro, PUC-Rio, Brasil.;1734032782594771;Hugo Fuks;Rio de Janeiro
1916245590298485;João Paulo Silva do Monte Lima;Universidade Federal Rural de Pernambuco, UFRPE, Brasil.;8817591964244237;João Paulo Lima;Pernambuco
7259733398888112;Valéria Ilsa Rosa;Fundação Universidade Regional de Blumenau, FURB, Brasil.;7259733398888112;Valéria Ilsa Rosa;Santa Catarina
8974163389393254;Celina Figueiredo Lage;Universidade do Estado de Minas Gerais, UEMG, Brasil.;8974163389393254;Celina Figueiredo Lage;Minas Gerais
5450557733379720;Eduardo Lázaro Martins Naves;Universidade Federal de Uberlândia, UFU, Brasil.;5870097378411046;Eduardo Lázaro M Naves;Minas Gerais
8205284377032041;Carina Marconi Germer;Universidade Federal de Pernambuco, UFPE, Brasil.;6413917211782026;Carina Marconi Germer;Pernambuco
3776300004312848;Djamel Fawzi Hadj Sadok;Conselho Nacional de Desenvolvimento Científico e Tecnológico, CNPq, Brasil.;3776300004312848;Djamel Fawzi Hadj Sadok;Distrito Federal
2142163449017349;Doris Catharine Cornelie Knatz Kowaltowski;FEC, UNICAMP, Brasil.;3977567032725249;Doris C C K Kowaltowski;São Paulo
6764226783548215;Cecília Félix Andrade Silva;Instituto Federal  Minas Gerais, IFMG, Brasil.;374012247711818;Cecilia Felix Andrade Silva;Minas Gerais
8158865847990189;Paulo Raimundo Pinto;Instituto Tecnológico Vale, ITV, Brasil.;374012247711818;Paulo Raimundo Pinto;Goiás
1722113830390578;Débora Aita Gasparetto;Universidade Federal de Santa Maria, UFSM, Brasil.;1722113830390578;Débora Aita Gasparetto;Rio Grande do Sul
3032638002357978;Bianchi Serique Meiguins;Universidade Federal do Pará, UFPA, Brasil.;5586729353238501;Bianchi Serique Meiguins;Pará
7949216376138752;Fabio Britto de Carvalho Almeida;SENAI-CIMATEC, CIMATEC, Brasil.;7949216376138752;Fabio Britto de Carvalho Almeida;Bahia
9369447081315501;Frederico da Silva Reis;Universidade Federal de Ouro Preto, UFOP, Brasil.;9369447081315501;Frederico da Silva Reis;Minas Gerais
9109602812218258;Nivaldi Calonego Junior;Universidade do Estado de Mato Grosso, UNEMAT, Brasil.;9109602812218258;Nivaldi Calonego Junior;Mato Grosso
4258800700795106;Ana Paula Piovesan Melchiori;Universidade Federal de Lavras, UFLA, Brasil.;3393043381118573;Ana Paula Piovesan Melchiori;Minas Gerais
9346178640224901;Luciene Cavalcanti Rodrigues;Instituto Federal de São Paulo, IFSP, Brasil.;9346178640224901;Luciene Cavalcanti Rodrigues;São Paulo
8801732223393153;Xisto Serafim de Santana de Souza Júnior;Conselho Nacional de Desenvolvimento Científico e Tecnológico, CNPq, Brasil.;8801732223393153;Xisto Serafim de Santana de Souza Júnior;Distrito Federal
1478736054440106;Alessandra Lopes Carvalho;Pontifícia Universidade Católica de Minas Gerais, PUC Minas, Brasil.;1478736054440106;Alessandra Lopes Carvalho;Minas Gerais
62949670854701136294967085470113;Luiz Cláudio Machado dos Santos;Universidade do Estado da Bahia, UNEB, Brasil.;6294967085470113;Luiz Cláudio Machado dos Santos;Bahia
9894979508465212;Guilherme Henrique Barros de Souza;Universidade Estadual Paulista Júlio de Mesquita Filho, UNESP, Brasil.;9894979508465212;Guilherme Henrique Barros de Souza;Pernambuco
1095395084173623;Fernando Firmino da Silva;Universidade Estadual da Paraíba, UEPB, Brasil.;1095395084173623;Fernando Firmino da Silva;Paraíba
7757325848359241;Edmilson Barbalho Campos Neto;Instituto Federal de Educação, Ciência e Tecnologia do Rio Grande do Norte, IFRN, Brasil.;7757325848359241;Edmilson Barbalho Campos Neto;Rio Grande do Norte
7830251697546483;Fabrício Herpich;Universidade Federal do Rio Grande do Sul, UFRGS, Brasil.;7830251697546483;Fabrício Herpich;Rio Grande do Sul
6482186733034818;Sandro Canavezzi de Abreu;Universidade Federal de Minas Gerais, UFMG, Brasil.;6482186733034818;Sandro Canavezzi de Abreu;Minas Gerais
5870097378411046;Júnior Edgard Lamounier;Universidade Federal de Uberlândia, UFU, Brasil.;1229329519982110;Edgard Lamounier;Minas Gerais
9637121030877187;Cristiano André da Costa;Universidade do Vale do Rio dos Sinos, UNISINOS, Brasil.;3914159735707328;Cristiano André da Costa;Rio Grande do Sul
5021830666471504;Mayara Lustosa de Oliveira Barbosa;Instituto Federal de Brasília, IFB, Brasil.;5021830666471504;Mayara Lustosa de Oliveira Barbosa;Distrito Federal
9306302347633373;Emerson de Sousa Costa;Centro Federal de Educação Tecnológica de Minas Gerais, CEFET/MG, Brasil.;9306302347633373;Emerson de Sousa Costa;Minas Gerais
9459123297426461;André Fagundes Pase;Pontifícia Universidade Católica do Rio Grande do Sul, PUCRS, Brasil.;9459123297426461;André Fagundes Pase;Rio Grande do Sul
7286663892055106;Maria Aparecida Alves de Cerqueira Luz;Faculdade de Odontologia da Universidade de São Paulo, FOUSP, Brasil.;7286663892055106;Maria Aparecida Alves de Cerqueira Luz;São Paulo
1233049484488761;Joao Fernando Marar;Universidade Estadual Paulista Júlio de Mesquita Filho, UNESP, Brasil.;1882712230914196;João Fernando Marar;Pernambuco
9138713186222689;Diane Belusso;INSTITUTO FEDERAL DO PARANA, IFPR, Brasil.;9138713186222689;Diane Belusso;Paraná
0987947348533817;Luciana de Oliveira Berretta;Universidade Federal de Goiás, UFG, Brasil.;7206645857721831;Luciana de Oliveira Berretta;Goiás
9375430645513797;Agrinaldo Jacinto do Nascimento Junior;Instituto Federal de Brasília, IFB, Brasil.;9375430645513797;Agrinaldo Jacinto do Nascimento Junior;Distrito Federal
4566977125542380;Josiane Medina Papst;Universidade Estadual de Londrina, UEL, Brasil.;4566977125542380;Josiane Medina Papst;Paraná
8886697697917438;Carla Viana Coscarelli;Universidade Federal de Minas Gerais, UFMG, Brasil.;8886697697917438;Carla Viana Coscarelli;Minas Gerais
3683706649252319;Ezequiel Roberto Zorzal;Universidade Federal de São Paulo, UNIFESP, Brasil.;3683706649252319;Ezequiel Roberto Zorzal;São Paulo
0305629481310082;André Falcão Durão;Universidade Federal de Pernambuco, UFPE, Brasil.;305629481310082;André Falcão Durão;Pernambuco
0543232182796499;Sandro César Silveira Jucá;Instituto Federal do Ceará, IFCE, Brasil.;543232182796499;Sandro César Silveira Jucá;Ceará
3932830667802188;Felipe Jonathan da Silva Bispo;Universidade Federal do Rio de Janeiro, UFRJ, Brasil.;543232182796499;Jonathan Felipe da Silva;Rio de Janeiro
4134919454057451;Fabiana Frata Furlan Peres;Universidade Estadual do Oeste do Paraná, UNIOESTE, Brasil.;4134919454057451;Fabiana Frata Furlan Peres;Paraná
8205501453013894;Marcos Wagner de Souza Ribeiro;Universidade Federal de Jataí, UFJ, Brasil.;987947348533817;Marcos Wagner de Souza Ribeiro;Goiás
4892345821929149;Patricia Kayser Vargas Mangan;Universidade La Salle - Canoas, UNILASALLE, Brasil.;4892345821929149;Patricia Kayser Vargas Mangan;Rio Grande do Sul
1292601001838768;Leiva Casemiro Oliveira;Universidade Federal Rural do Semi-Árido, UFERSA, Brasil.;1292601001838768;Leiva Casemiro Oliveira;Rio Grande do Norte
5043080196932200;Diana Maria Gallicchio Domingues;Universidade de Brasília, UnB, Brasil.;5043080196932200;Diana Maria Gallicchio Domingues;Distrito Federal
6864702691556027;Lúcio Paulo do Amaral Crivano Machado;Universidade do Estado do Rio de Janeiro, UERJ, Brasil.;6864702691556027;Lúcio Paulo do Amaral Crivano Machado;Rio de Janeiro
5206162448542942;Rosane Moreira Silva de Meirelles;Fundação Oswaldo Cruz, FIOCRUZ, Brasil.;6864702691556027;Rosane Meirelles;Ceará
4649814099154237;Raquel Ritter Longhi;Universidade Federal de Santa Catarina, UFSC, Brasil.;4649814099154237;Raquel Ritter Longhi;Santa Catarina
8402249648328903;Joice Basílio Machado Marques;Instituto Federal de São Paulo, IFSP, Brasil.;8402249648328903;Joice Basílio Machado Marques;São Paulo
9724832203454429;Maria Lucia Leite Ribeiro Okimoto;Universidade Federal do Paraná, UFPR, Brasil.;9724832203454429;Maria Lucia Leite Ribeiro Okimoto;Paraná
3483462003007835;Rafael de Moura Speroni;Instituto Federal Catarinense, IF-Catarinense, Brasil.;3483462003007835;Rafael de Moura Speroni;Santa Catarina
0501764855693100;Sandra Dutra Piovesan;Universidade Federal do Pampa, UNIPAMPA, Brasil.;501764855693100;Sandra Dutra Piovesan;Rio Grande do Sul
7243757837987821;Andréia Machado Oliveira;Universidade Federal de Santa Maria, UFSM, Brasil.;7243757837987821;Andréia Machado Oliveira;Rio Grande do Sul
8840903885852886;Angela Maria Chuvas Naschold;Universidade Federal do Rio Grande do Norte, UFRN, Brasil.;8840903885852886;Angela Maria Chuvas Naschold;Rio Grande do Norte
3802040243557689;Alexandre Hering Coelho;Universidade Federal de Santa Catarina, UFSC, Brasil.;3802040243557689;Alexandre Hering Coelho;Santa Catarina
4162291555771478;Marcelo Vera Cruz Diniz;Instituto Federal da Bahia, IFBA, Brasil.;4162291555771478;Marcelo Vera Cruz Diniz;Bahia
2646104845996419;Teófilo Augusto da Silva;Universidade Federal do Sul e Sudeste do Pará, UNIFESSPA, Brasil.;2646104845996419;Teófilo Augusto da Silva;Pará
1868960602254610;Rummenigge Rudson Dantas;Universidade Federal do Rio Grande do Norte, UFRN, Brasil.;1868960602254610;Rummenigge Rudson Dantas;Rio Grande do Norte
7565187316136027;Rodrigo Martins de Oliveira Spinosa;Universidade Estadual de Londrina, UEL, Brasil.;7565187316136027;Rodrigo Martins de Oliveira Spinosa;Paraná
0463363430536002;Davi Guimarães da Silva;Instituto Federal de Educação, Ciência e Tecnologia do Pará, IFPA, Brasil.;463363430536002;Davi Guimarães da Silva;Pará
7206887618857384;Carla Maria Furuno Rimkus;Universidade Federal de Sergipe, UFS, Brasil.;7206887618857384;Carla Maria Furuno Rimkus;Sergipe
