lattes id;coordenador;ano inicio;ano fim;titulo;type
584425766553916.0;Nara Cristina Santos;2015.0;Atual;Museu Interativo Arte - Ciência - Tecnologia;AR
4321649532287831.0;Verônica Teichrieb;2018.0;2020;Projeto HP - NonFlatAR;AR
4321649532287831.0;Verônica Teichrieb;2010.0;2012;ARVS - Hybrid model based markerless 3D tracking for augmented reality and visual servoing;AR
4321649532287831.0;Judith Kelner;2007.0;2011;TechPetro;AR
2672736578186109.0;Eduardo Galembeck;2015.0;2019;Projeto Animálculo;AR
2672736578186109.0;Eduardo Galembeck;2014.0;2016;A estratégia de resolução de problemas com ferramentas virtuais no ensino de Bioquímica;AR
9173006904247472.0;DAVID CORREA MARTINS JUNIOR;2018.0;Atual;[CAPES-Print UFABC] Data Science;AR
4520293519781462.0;Sérgio Murilo Maciel Fernandes;2004.0;2005;Tecnologias da Informação em Apoio ao Ensino Presencial;AR
886941225536719.0;Paulo Tadeu de Souza Figueiredo;2015.0;Atual;Avaliação das alterações osteometabólicas causadas por bisfosfonatos em mandíbulas de ratas por meio do PET/CT.;AR
1790662929908503.0;Luciene Chagas de Oliveira;2020.0;2022;COMPUTAÇÃO APLICADA NA PREVENÇÃO E NO COMBATE A DOENÇAS CAUSADAS POR CORONAVÍRUS E POR OUTROS TIPOS DE VÍRUS (PIBITI 2020/009);AR
4904489502853690.0;Isabel Harb Manssour;2023.0;Atual;Visualização de dados no suporte à análise, exploração e pré-processamento em Ciência de Dados na área da saúde;AR
4904489502853690.0;;2004.0;2004;Pesquisa em armazenamento, processamento e visualização de imagens médicas;AR
6045470959652684.0;Giordano Ribeiro Eulalio Cabral;2013.0;2016;Música, Tecnologia, Interatividade e Criatividade (CNPq Universal 2013);AR
5778704270592010.0;Araci Hack Catapan;2012.0;2019;Metodologias e experiência exitosas na implementação da Rede e-Tec Brasil;AR
4186515742605446.0;Victor Hugo Costa de Albuquerque;2013.0;2017;Sistemas inteligentes aplicados na área biomédica;AR
1916245590298485.0;Veronica Teichrieb;2010.0;2011;Hybrid model based markerless 3D tracking for augmented reality and visual servoing;AR
1522479715721496.0;Ivan Müller;2014.0;2017;Gerenciamento distribuído para handover de dispositivos móveis em redes sem fio industriais;AR
1522479715721496.0;Carlos Eduardo Pereira;2011.0;2016;Eletrônica Embarcada em Equipamentos - E3, subprojeto SA-WH;AR
1168989222280325.0;Paulo Vitor Rodrigues  de Carvalho;2020.0;Atual;Ações Educativas em Resposta a Emergência na Saúde, Indústria e Desastres;AR
1168989222280325.0;Antônio Carlos de Abreu Mól;2019.0;Atual;Realidade Virtual Aplicada na Gerência de Rejeitos Radioativos;AR
1168989222280325.0;Antônio Carlos de Abreu Mól;2019.0;Atual;Realidade Virtual como Meio no Desenvolvimento de Aplicações com Finalidade de Promover e Desmistificar a Utilização da Energia Nuclear;AR
1168989222280325.0;SIQUEIRA, ANA PAULA LEGEY DE;2017.0;2019;DESENVOLVIMENTO DAS HABILIDADES DE ALUNOS POR MEIO DA ROBÓTICA EM ATIVIDADES EXTRACURRICULARES: UM ESTUDO DE CASO  EM UMA ESCOLA PARTICULAR NO RIO DE JANEIRO (RJ);AR
1168989222280325.0;SIQUEIRA, ANA PAULA LEGEY DE;2017.0;Atual;Promoção do Interesse pela ciência por meio do uso da realidade virtual na demonstração de um experimento científico;AR
1168989222280325.0;Ana Paula Legey de Siqueira;2016.0;Atual;Criação de vídeo 3D, holograma e jogo digital para apresentar a energia solar como fonte de geração de energia elétrica por meio de um espaço de ciência itinerante;AR
5996993884846655.0;Virginia Rodes;2022.0;Atual;Medallas Red Global, un ecosistema de aprendizaje gamificado para desarrollar competencias transversales en el aula;AR
5996993884846655.0;José Valdeni de Lima;2011.0;2012;LWM - Learning While Moving;AR
5996993884846655.0;José Palazzo Moreira de Oliveira;2008.0;2011;Avaliação da qualidade acadêmica baseada em ontologia e mineração de dados na Web;AR
5996993884846655.0;José Palazzo Moreira de Oliveira;2007.0;2010;Gestão de grandes volumes de documentos textuais (edital MCT/CNPq/CT-INFO nº 07/2007);AR
2259041691301555.0;;2016.0;2019;LARVA - LABORATORY FOR RESEARCH ON VISUAL APPLICATIONS;AR
2259041691301555.0;Marcelo da Silva Hounsell;2008.0;2010;Linguagem para programação de robôs;AR
2259041691301555.0;Marcelo da Silva Hounsell;2005.0;2008;Engenharia de Software para Realidade Virtual (DAPE 028/05);AR
8964123297688432.0;ARTHUR JOSE VIEIRA PORTO;2005.0;2010;Caverna Digital - Laboratório Multiusuário de Visualização 3D Imersiva de São Carlos - Processo Num. 04/09275-3;AR
3216441382223685.0;Florin Popescu;2016.0;2017;SEE.4C - SpatiotEmporal ForEcasting: Coopetition to meet Current Cross-modal Challenges;AR
978647563169137.0;Suhaila Mahmoud Smaili Santos;2021.0;Atual;A especificidade da tarefa - Estimulação Transcraniana por Corrente Contínua associada ao treino de tarefa dupla - pode impactar em ganhos na doença de Parkinson? Um protocolo para um estudo controlado randomizado;AR
3196052576107598.0;BIANCHI, ANDREA G. C.;2019.0;2020;Estudo e desenvolvimento de um arcabouço para teleoperação avançada de equipamentos de mineração: Monitoramento de Correias Transportadoras - FASE II;AR
3196052576107598.0;Saul Emanuel Delabrida Silva;2019.0;Atual;Avaliação do Uso de Realidade Estendida para processos Industriais: Estudo de caso Correias Transportadoras;AR
3196052576107598.0;OLIVEIRA, RICARDO A. RABELO;2015.0;2016;Oiaprocêvê - Operational Personal Computer Vision;AR
5548205054206839.0;Marco Aurélio Wehrmeister;2019.0;Atual;Plataforma Computacional para Sistemas de Aeronaves Não-Tripuladas voltada ao Processo de Inspeção e Manutenção de Redes de Transmissão de Energia;AR
5548205054206839.0;;2015.0;2015;On Using Low-Cost Thermal Cameras in Unmanned Aerial Vehicles for Search and Rescue Applications;AR
5548205054206839.0;Carlos Eduardo Pereira;2005.0;2007;Ambientes Inteligentes - Sistemas Computacionais Distribuídos Sensíveis e Adaptativos ao Usuário em Automação Predial;AR
3534918669459073.0;Lucas Ferrari de Oliveira;2012.0;Atual;Análise e Classificação de Patologias Pulmonares em Imagens de Tomografia Computadorizada;AR
2799879318334876.0;Sandra Aparecida Sandri;2012.0;2016;Inteligência Computacional em Análise de Imagens de Radar de Abertura Sintética;AR
5117339495064254.0;Thiago Oliveira dos Santos;2022.0;Atual;Infraestrutura para Projetos interdisciplinares de Informática Aplicada à Saúde;AR
5117339495064254.0;Alberto Ferreira De Souza;2021.0;Atual;Instituto de Inteligência Computacional Aplicada - I2CA;AR
5117339495064254.0;Alberto Ferreira De Souza;2019.0;2022;Carros Autônomos SAE Nível 5;AR
5117339495064254.0;Alberto Ferreira De Souza;2016.0;2021;Visão Artificial e Robótica Autônoma Aplicadas à Mineração;AR
2446301582459104.0;;2022.0;Atual;Diagnóstico de patologias em radiografias torácicas utilizando redes neurais profundas;AR
2446301582459104.0;PAIVA, ANSELMO CARDOSO;2022.0;Atual;Inteligência Computacional no Apoio às Ações de Controle Externo - ICCE;AR
2446301582459104.0;Aristófanes Corrêa Silva;2021.0;Atual;Análise e Processamento de Imagens Médicas usando Aprendizagem Profunda;AR
2446301582459104.0;DE ALMEIDA, JOAO DALLYSON SOUSA;2020.0;Atual;Rastreamento automático de deformidades da coluna vertebral em imagens;AR
2446301582459104.0;Anselmo Cardoso de Paiva;2013.0;Atual;Detecção e Diagnóstico de Câncer de Mama e Pulmão Usando Análise de Diversidade e Análise Geométrica;AR
2446301582459104.0;Anselmo Cardoso de Paiva;2012.0;Atual;Detecção e Diagnóstico de Cancer de Mama e Pulmão;AR
1744732999336375.0;Windson Viana de Carvalho;2016.0;2018;Oficinas de Animação e Jogos Locativos como Fator de Ambientação e Integração entre os Cursos de Graduação em Design, Cinema, Computação e Sistemas e Mídias Digitais da UFC;AR
4682380099012723.0;Luiz Landau;2018.0;2020;PEC-21448-Simulador de Emergência Virtual;AR
4682380099012723.0;Luiz Landau;2016.0;2016;PEC-19386-Integração de Seepage Slicks Interpretados a Partir de Imagens RADARSAT com dados Geológicos e Tectônicos na Região do Golfo do México.;AR
4682380099012723.0;Luiz Landau;2014.0;2015;PEC-18513-Campanha Prévia do Projeto DETECTA (Desenvolvimento de Tecnologias Integradas para Detecção e Previsão de Óleo no Mar na Margem Equatorial Brasileira);AR
4682380099012723.0;Luiz Landau;2012.0;2014;PEC-15060-Detecção de Feições de Óleo na Superfície do Mar Utilizando Dados dos Satélites RADARSAT-2 e Modelagem Invresa da Trajetória na Área de Sapinhoá, bacia de Santos;AR
4682380099012723.0;Luiz Landau;2012.0;2013;PEC-16122-Monitoring of Natural OIL Seeps and Oil Spills Through the Use of RADARSAT -1  and RADARDAT-2 Satelite Imagens in the Gulf of Mexico 2012;AR
4682380099012723.0;Luiz Landau;2011.0;2012;PEC-14495-Detecção e Modelagem Inversa de Exsudações de Óleo no Bloco P-M-2 e Adjacências, na Bacia de Pelotas;AR
4682380099012723.0;Luiz Landau;2010.0;2012;PEC-13032-Detecção de Feições de Óleo na Superfície do Mar Utilizando Dados dos Satélites RADARSAT-2 e Modelagem Inversa da Trajetória na Área de TUPI/IRACEMA, Bacia de Santos;AR
4682380099012723.0;Luiz Landau;2007.0;2012;PEC-10068-Monitoring of Natural Petroleum Seeps and Spills Using RADARSAT 1/2 Satelite Imagens in the Gulf of Mexico;AR
4682380099012723.0;Luiz Landau;2006.0;2006;PEC-7955-Detecção de Oil Seeps na Região Oceânica da Tanzânia (bloco 5 e 6) com Dados RADARSAT-1;AR
4682380099012723.0;Luiz Landau;2002.0;2004;PEC-2694-Sistema de Monitoramento de Derrames de Óleo em Ambiente Marinho;AR
4682380099012723.0;Luiz Landau;1999.0;2003;PEC-761-Monitoramento de Exsudações de Óleo na Margem Continental Brasileira Utilizando Imagens Radarsat como Subsídio à Exploração Petrolífera.;AR
9999217523842384.0;Guilherme Bittencourt;2003.0;2007;Projeto Math_net: Uma abordagem via sistemas multiagentes para concepção e realização de ambientes interativos de aprendizagem;AR
875383284956116.0;Mauro Cesar Gurgel de Alencar Carvalho;2003.0;2004;ESTUDOS DE VARIÁVEIS ANTROPOMÉTRICAS EM JUDOCAS;AR
6019497081054686.0;Jose Eurico de Vasconcelos Filho;2019.0;Atual;Fortaleza Digital;AR
6019497081054686.0;BRASIL, CHRISTINA CESAR PRAÇA;2018.0;Atual;Avaliação de um programa de promoção da saúde vocal de professores amparado por tecnologias eHealth - Edital PIBIC/CNPQ/UNIFOR 2018;AR
6019497081054686.0;BRASIL, CHRISTINA CÉSAR PRAÇA;2018.0;Atual;Facebook como ferramenta de apoio ao diagnóstico participativo em Saúde - Edital PROBIC/FEQ 2018;AR
6019497081054686.0;BRASIL, CHRISTINA CÉSAR PRAÇA;2017.0;Atual;Uso da tecnologia no diagnóstico participativo dos problemas que interferem na saúde de uma comunidade vulnerável;AR
6019497081054686.0;BRASIL, CHRISTINA CÉSAR PRAÇA;2017.0;Atual;Tecnologia M-health como ferramenta de promoção da saúde vocal - Chamada UNIVERSAL 01/2016 - Faixa A;AR
6019497081054686.0;Jose Eurico de Vasconcelos Filho;2017.0;Atual;OCARIoT - smart childhood Obesity CARing solution using IoT potential;AR
6019497081054686.0;BRASIL, CHRISTINA CÉSAR PRAÇA;2017.0;Atual;Tecnologia de apoio às intervenções terapêuticas antitabagismo - Edital PIBIC/CNP/UNIFOR 2017;AR
6019497081054686.0;BRASIL, CHRISTINA CÉSAR PRAÇA;2016.0;2017;M-Health para a promoção da saúde da mulher: tecnologia para inovação nas gestão da saúde vocal de professoras - EDITAL 37/2016 - PIBITI/CNPq 2016;AR
6019497081054686.0;BRASIL, CHRISTINA CÉSAR PRAÇA;2016.0;2017;Tecnologia inovadora de apoio individualizado na gestão do uso da voz;AR
6019497081054686.0;Raimunda Magalhães da Silva;2015.0;Atual;M-Health para a promoção da saúde da mulher - EDITAL PRONEX 02/2015 - PRONEX/FUNCAP/CNPQ;AR
6019497081054686.0;BRASIL, CHRISTINA CÉSAR PRAÇA;2014.0;2016;Desenvolvimento e validação de uma tecnologia mHealth de apoio à gestão do uso da voz;AR
6019497081054686.0;Raimunda Magalhães da Silva;2013.0;2017;AVALIAÇÃO E GESTÃO DE TECNOLOGIA INFORMACIONAL PARA O ATENDIMENTO A GESTANTE NA REDE DE ATENÇÃO BÁSICA EM SAÚDE;AR
8626964624628522.0;Fátima de Lourdes dos Santos Nunes Marques;2019.0;Atual;Auxílio ao diagnóstico do transtorno do espectro autista;AR
8626964624628522.0;DELAMARO, MARCIO EDUARDO;2017.0;Atual;Teste de mutação aplicado a ambientes de realidade virtual modelados com grafo de cena;AR
8626964624628522.0;Fátima de Lourdes dos Santos Nunes Marques;2010.0;2016;Proposição, implementação e validação de técnicas para  treinamento médico virtual interativo;AR
1594563006260546.0;Hugo Hernando Andrade Sosa;2012.0;2013;Lineamientos para la formación inicial de docentes en el uso pedagógico de la TIC  - Orientada al mejoramiento e la innovación educativa desde la universidad;AR
1594563006260546.0;Juarez Bento da Silva;2008.0;2009;Utilização da experimentação remota como suporte a ambientes de ensino-aprendizagem na rede pública de ensino;AR
1594563006260546.0;Juarez Bento da Silva;2008.0;2009;A experimentação remota como apoio ao processo ensino-aprendizagem de física no ensino médio, utilizando como experimento o ROBOCAR.;AR
649930882307115.0;Francisco Carlos de Mattos Brito Oliveira;2020.0;Atual;THUNDER (Talent Hunting and Developer Recruitment): Projeto de Capacitação Tecnológica e Descoberta de Talentos em Tecnologia da Informação;AR
649930882307115.0;Francisco Carlos de Mattos Brito Oliveira;2019.0;Atual;ARlity Training Arcade (ARTRADE) Ano II;AR
5242996146285625.0;Mauricio Fernando Lima Pereira;2009.0;Atual;Desenvolvimento de um computador embarcado, baseado em arquitetura ARM para uso em agricultura de precisão;AR
4903908392101557.0;Guido Lemos de Souza Filho;2000.0;2001;NatalNet - Rede Metropolitana de Alta Velocidade da cidade de Natal;AR
4298412581612922.0;Rafael P. Torchelsen;2011.0;2012;Collaborative interface using augmented reality to visualization of data mapped on three-dimensional structures.;AR
3278791354439256.0;Miburge Bolivar Gois Junior;2017.0;2018;Avaliação do equilíbrio corporal estático e dinâmico e risco de quedas em indivíduos com uma mutação no gene do GHRHR;AR
3278791354439256.0;Miburge Bolivar Gois Junior;2017.0;2018;Padronização do teste de caminhada de 6 minutos para indivíduos com deficiência do GH e mutação no gene do GHRHR;AR
3278791354439256.0;Miburge Bolivar Gois Junior;2017.0;2018;Avaliação da força e fatigabilidade em indivíduos com deficiência do GH;AR
3278791354439256.0;Miburge Bolivar Gois Junior;2017.0;Atual;PAPEL DO IGF-I NA MODULAÇÃO FENOTÍPICA MUSCULAR EM INDIVÍDUOS HOMOZIGOTOS PARA UMA MUTAÇÃO NO GENE DO GHRHR;AR
3278791354439256.0;Miburge Bolivar Gois Junior;2017.0;Atual;Avaliação do sistema vestibulo-ocular em indivíduos com DIGH para uma mutação no gene do GHRHR;AR
5065548216266121.0;Thais Vasconcelos Batista;2019.0;Atual;Plataforma Geo-referenciada para Desenvolvimento de Aplicações para Cidades Inteligentes;AR
5065548216266121.0;Thais Vasconcelos Batista;2017.0;Atual;SmartPlace - Uma Aplicação para Gerenciamento de Espaços Físicos visando Economia de Energia;AR
5515322256604194.0;LUCIENE STAMATO DELAZARI;2022.0;Atual;INTEGRAÇÃO DE DADOS GEOESPACIAIS PARA DESENVOLVIMENTO DE UM SMART CAMPUS;AR
5515322256604194.0;Marcio Augusto Reolon Schmidt;2017.0;2021;VISUALIZAÇÃO CARTOGRÁFICA TRIDIMENSIONAL EM TEMPO REAL APLICADA A NAVEGAÇÃO EM DISPOSITIVOS MÓVEIS;AR
5515322256604194.0;Marcio Augusto Reolon Schmidt;2017.0;2019;Propagação variâncias em levantamentos topográficos;AR
5515322256604194.0;Marcio Augusto Reolon Schmidt;2012.0;2015;Aplicação  de  técnicas  fotogramétricas  no  monitoramento  geodésico  para  no monitoramento de obras civis e geotécnicas;AR
5515322256604194.0;LUCIENE STAMATO DELAZARI;2011.0;2015;AVALIAÇÃO DE INTERFACES, CONTEXTOS DE USO E USUÁRIOS DE MAPAS;AR
813823100105934.0;COZMAN, FABIO GAGLIARDI;2020.0;Atual;Center for Artificial Intelligence (C4AI);AR
813823100105934.0;Romero Tori;2007.0;2009;FAPESP TIDIA-Ae (fase 2) Aprendizado Eletronico sobre Plataforma de Redes de Alta Velocidade;AR
7367251955373676.0;;2015.0;Atual;ESTUDO DAS RELAÇÕES DE HIBRIDAÇÃO NOS PROCESSOS ARTÍSTICOS EM BELÉM (PA) NAS DÉCADAS DE 1980 A 1990;AR
7367251955373676.0;Regina Ribeiro Cunha;2014.0;Atual;Perfil de Estomizados no Contexto Amazônico (PESCA);AR
4109110009789771.0;;2018.0;Atual;VISCARB - Atlas Digital Interativo com Visualização 3D de Análogos em Várias Escalas e Modelagem Multiescalar;AR
4109110009789771.0;;2012.0;2017;MoDA: Modelagem Digital de Afloramentos usando GPU;AR
7757263196193233.0;Judith Kelner;2020.0;Atual;Visão Computacional para Monitoramento de Sistemas Submarinos;AR
7757263196193233.0;Judith Kelner;2016.0;2018;Extensão do Sois: Ferramenta de Monitoração e Suporte à Operação de Instalações Submarinas;AR
2352130203106125.0;Maria Cristina Nascentes Cabral;2021.0;Atual;Cultura Arquitetônica e o Habitat moderno;AR
2352130203106125.0;Andrés  Martin Pássaro;2019.0;2021;Arquitetura em revista: catálogo e exposição de projetos na temática do Congresso da UIA 2020;AR
3010497094377497.0;Rafael Rieder;2022.0;Atual;Metaverso para Educação e Assistência Multidisciplinar em Saúde;AR
3010497094377497.0;ANA CAROLINA BERTOLETTI DE MARCHI;2018.0;2022;Sistema e-Lifestyle: uma solução e-Health para monitoramento das condições de saúde de pacientes hipertensos;AR
3010497094377497.0;Rafael Rieder;2018.0;2022;Motion Rehab AVE 3D: um exergame de Realidade Virtual para reabilitação pós-AVE;AR
3010497094377497.0;ANA CAROLINA BERTOLETTI DE MARCHI;2014.0;2018;Proposição de diretrizes de usabilidade para o desenvolvimento de aplicações para treino cognitivo;AR
3010497094377497.0;Rafael Rieder;2014.0;Atual;Tecnologias e metodologias para o desenvolvimento de soluções computacionais em cidades inteligentes;AR
3010497094377497.0;Roberto dos Santos Rabello;2012.0;2014;Integração de Técnicas e Metodologias para Implantação de uma Fábrica de Software;AR
3010497094377497.0;Adriano Canabarro Teixeira;2011.0;2013;Tecnologias e Metodologias de Inclusão Digital na Cibercultura: Por uma cultura hacker na educação!;AR
3010497094377497.0;JULIANO TONEZER DA SILVA;2005.0;2013;Computação Aplicada ao Arranjo Produtivo de Gemas e Joias;AR
9694457902995524.0;Andre Arigony Souto;2018.0;Atual;INVESTIGAÇÃO DA ATIVIDADE E DA SELETIVIDADE  SENOLÍTICA DE COMPOSTOS NATURAIS;AR
9694457902995524.0;Andre Arigony Souto;2014.0;Atual;Aplicação de polifenois na dentina humana: Estudo in vitro da morfologia interfacial e da resistência de união;AR
9694457902995524.0;Andre Arigony Souto;2012.0;2017;3º ADITIVO AO CONTRATO DE LICENÇA DE USO DE KNOW HOW, SEGREDOS INDUSTRIAIS;AR
9694457902995524.0;Basso, Luiz A.;2008.0;Atual;BORDAGEM RACIONAL PARA O DESENVOLVIMENTO DE DROGAS PARA TRATAR, VACINAS PARA PREVENIR, E MÉTODOS DE DIAGNÓSTICO PARA DETECTAR O Mycobacterium tuberculosis, AGENTE CAUSADOR DA TUBERCULOSE (TB);AR
7838983448809586.0;;2005.0;2007;Modelos de Cooperação, Coordenação e Comunicação Aplicados a Sistemas Colaborativos de Automação;AR
3849851399700826.0;Itamar Iliuk;2016.0;Atual;Sistema de correção automatizada para testes psicológicos utilizando processamento de imagem e reconhecimento de padrões;AR
4394162331037750.0;Alberto Barbosa Raposo;2020.0;Atual;Avaliação do Volume e Acometimento Pulmonar através de Imagens 3D - Visualização e Análise de Dados em Plataformas de Telemedicina;AR
4394162331037750.0;Alberto Barbosa Raposo;2016.0;Atual;Livre para voar;AR
4394162331037750.0;Joaquim A. Jorge;2010.0;2014;CEDAR ? Design e Revisão Colaborativa de Modelos de Engenharia;AR
9931293076574400.0;;2014.0;Atual;ARSTUDIO - Inovação na Geração de Conteúdo digital para Televisão, Cinema e Educação à Distância utilizando Técnicas de Realidade Aumentada;AR
9756167788721062.0;Valquíria Gusmão Macedo;2005.0;2008;Programa Inovar Pará: Sistema Computacional para Aprendizado de Línguas Estrangeiras baseado em Processamento de Voz.;AR
240551533292579.0;Liliane dos Santos Machado;2008.0;2013;Laboratórios Virtuais e Remotos para Ensino em Engenharia;AR
9414097844432952.0;Tania Aparecida Marchiori de Oliveira Cardoso;2014.0;2016;Projeto ISACamp-Sono: Duração, qualidade e distúrbios relacionados ao sono em estudo de base populacional em Campinas,SP.;AR
2226174429595901.0;Lynn Rosalina Gama Alves;2021.0;Atual;Plataformas Digitais de Ensino: um estudo de caso da interação dos docentes da UFBA, UNEB, IFPB e IF Baiano;AR
2277559773788201.0;Giliane Bernardi;2018.0;Atual;SAGaPE - Smart Adaptive Gamification Platform for Education;AR
1813801866195427.0;Giorgio Eugenio Oscare Giacaglia;2016.0;2019;PROJETO DE VEICULOS;AR
2479982770095588.0;Daniel de Carvalho Moreira;2017.0;Atual;Tecnologias de representação;AR
3355272528185691.0;;2019.0;Atual;Viajero Project;AR
3355272528185691.0;Joaquim Jorge;2012.0;2014;CEDAR;AR
3355272528185691.0;Alberto Barbosa Raposo;2012.0;Atual;SimUEP-Robotics;AR
4783303936149244.0;NASCIMENTO, MARIA C.V.;2016.0;2018;Hibridização de métodos heurísticos e exatos para abordar problemas de otimização combinatória;AR
483707899231728.0;Milene Selbach Silveira;2021.0;2023;Análise qualitativa de dados advindos de transmissões de vídeos identificados por meio de picos de postagens no Twitter;AR
277705848688464.0;Claudio Kirner;1991.0;1993;Projeto de um Sistema de Computação Paralela Híbrida;AR
277705848688464.0;Claudio Kirner;1983.0;1984;Projeto de uma Rede de Microcomputadores;AR
883301163870314.0;MARIA HELENA WYLLIE LACERDA RODRIGUES;1998.0;2004;Integração das Técnicas de Representação Gráfica: um Trabalho Interdisciplinar com Apoio do Computador;AR
4616848792501359.0;Leandro Augusto Frata Fernandes;2020.0;2021;CNN-Based Telemedicine System for Diabetic Foot Ulcer Evolution Analysis;AR
4123700143485891.0;Rodrigo Cury Paraizo;2019.0;2020;Representações da história urbana do Rio de Janeiro em mídias locativas: a Exposição do Centenário de 1922;AR
878410768350416.0;Liane Margarida Rockenbach Tarouco;2008.0;2010;Objetos de Aprendizagem Baseados em Agentes;AR
878410768350416.0;Liane Margarida Rockenbach Tarouco;1998.0;2015;LUAR-Levando a Universidade à Aprendizagem Remota;AR
878410768350416.0;Liane Margarida Rockenbach Tarouco;1996.0;Atual;Nucleo disciplinário Redes Acadêmicas;AR
5219735119295290.0;Walter dos Santos Oliveira Junior;2022.0;Atual;EduTech Amazon: Uso de inteligência artificial para reconhecimento de padrão geométrico em streaming em uma aplicação no ensino da educação básica através do App Geometricando VR e AR;AR
3355338790654065.0;Veronica Teichrieb;2013.0;Atual;Pesquisa e Desenvolvimento de uma Ferramenta Tecnológica para Estudos Comparativos entre Métodos de Simulação Numérica Clássicos, de Partículas e Dados de Ensaios Experimentais no âmbito da Dinâmica de Embarcações Submersas em Fluidos Turbulentos;AR
1733480322650561.0;Carla Rosane da Silva Tavares;2010.0;2011;A representação da Mulher em o tempo e o vento: um panorama histórico-social;AR
6402361744624287.0;Alvaro Luiz Gayoso de Azeredo Coutinho;2021.0;Atual;Pesquisa e Desenvolvimento em Aprendizado de Máquina Científico em Computadores de Alto Desempenho para Problemas de Engenharia;AR
6402361744624287.0;Alvaro Luiz Gayoso de Azeredo Coutinho;2021.0;Atual;Centro de Excelência em Transformação Digital e Inteligência Artificial do Estado do Rio de Janeiro (Hub.Rio): Rede Temática em Energias Renováveis e Mudanças Climáticas;AR
6402361744624287.0;Alvaro Luiz Gayoso de Azeredo Coutinho;2020.0;Atual;Centro de Excelência em Transformação Digital e Inteligência Artificial do Estado do Rio de Janeiro (Hub.Rio): Rede Temática de Combate aos Efeitos da COVID-19;AR
6402361744624287.0;Patrick Valduriez;2020.0;Atual;INRIA Associate Team: HPDaSc- High Performance Data Science;AR
6402361744624287.0;Alvaro Luiz Gayoso de Azeredo Coutinho;2014.0;2017;Pesquisa e Desenvolvimento em Simulacao de Processos Geologicos em Computadores de Alto Desempenho: Novos Desafios;AR
6402361744624287.0;;2012.0;2015;High Performance Computing and Scientific Data Management - HOSCAR;AR
6402361744624287.0;Alvaro Luiz Gayoso de Azeredo Coutinho;2011.0;2013;Pesquisa e Desenvolvimento em Simulação de Processos Geológicos em Computadores de Alto Desempenho;AR
9873333807426188.0;Andrei Piccinini Legg;2017.0;Atual;Apoio ao Lançamento, Pesquisa e Operação do NANOSATC-BR2;AR
9873333807426188.0;Andrei Piccinini Legg;2016.0;2019;Integração de Nanosatélites - Desenvolvimento de Placa Integradora NCBR2;AR
9873333807426188.0;Renato Machado;2014.0;Atual;MULTIPLE INPUT MULTIPLE OUTPUT (MIMO) SYNTHETIC APERTURE RADAR (SAR) ALGORITHMS AND SIGNAL PROCESSING TO DETECT CHANGES AND MOVEMENTS - MEC/MCTI/CAPES/CNPQ/FAPS - BOLSA PESQUISADOR VISITANTE ESPECIAL - PVE 2014;AR
5587405998574264.0;Anderson Maciel;2011.0;2014;Simulador de comportamento para atividades operacionais voltado à área de segurança;AR
5587405998574264.0;Diana Maria Gallicchio Domingues;2005.0;2006;Ciberarte: ambientes interativos e imersivos;AR
695899382782312.0;Sergio Scheer;2004.0;Atual;Técnicas de Visualização Interativa em Problemas de Engenharia;AR
839323666578855.0;Mauricio Capobianco Lopes;2015.0;2016;Currículo, formação e aprendizagem colaborativa: tecnologias digitais potencializando práticas docentes;AR
3660344606587105.0;Francisco Henrique de Oliveira;2010.0;2013;Sistema inteligente de suscetibilidade a enchentes,  Estudo de caso: Bacia Hidrográfica do Rio Cachoeira - Joinville/SC;AR
1233049484488761.0;Joao Fernando Marar;2014.0;2017;Aspectos Teóricos e Práticos da Ciência Cognitiva para o auxilio no Projeto de Produto;AR
1233049484488761.0;;2006.0;2008;Design & Seleção de Materiais - Apoio Técnico para a Elaboração e Implementação de um Sistema de Informações para Projeto de Produtos;AR
