lattes id;coordenador;ano inicio;ano fim;titulo;tipo
5399173621955960;Roberto dos Santos Bartholo Jr.;2014;2017;Janelas Abertas para a República;Realidade Aumentada
0176951751504724;Luciene Cavalcanti Rodrigues;2010;2011;Realidade Aumentada Aplicada ao Ensino de Geometria Espacial;Realidade Aumentada
0293579016789844;None;2014;Atual;O Uso de Interface Natural no Desenvolvimento de uma Aplicação de Realidade Aumentada Interativa para Visualização da Informação de Eventos Meteorológicos;Realidade Aumentada
0293579016789844;None;2012;Atual;Desenvolvimento de uma aplicação para a importação e execução de aplicações de Realidade Aumentada com base nas funcionalidades Interativas do Sistema Operacional Android.;Realidade Aumentada
0293579016789844;None;2011;2012;Desenvolvimento de uma Ferramenta web para geração de aplicações de Realidade Aumentada por meio de programação visual;Realidade Aumentada
0293579016789844;None;2011;2012;Estudo da Biblioteca Artoolkit e o seu uso no Desenvolvimento de Aplicações de Realidade Aumentada para Desktop;Realidade Aumentada
0293579016789844;None;2011;Atual;Desenvolvimento de Aplicações de Realidade Aumentada para Dispositivos Móveis com Sistema Operacional ANDROID;Realidade Aumentada
0293579016789844;None;2005;2007;Usando técnicas de realidade aumentada no processo de inclusão digital de crianças hospitalizadas - Usando técnicas de realidade aumentada no processo de inclusão digital de crianças hospitalizadas;Realidade Aumentada
7084786275034469;Paulo Henrique Siqueira;2019;Atual;Utilização de ferramentas web para desenvolvimento de materiais didáticos em Realidade Aumentada e Realidade Virtual;Realidade Aumentada
8073228416136256;Marcelo Gitirana Gomes Ferreira;2010;2012;Avaliação da usabilidade de produtos eletroeletrônicos com o auxílio de Realidade Virtual e Realidade Aumentada;Realidade Aumentada
3284179037499048;Antonio Carlos dos Santos Souza;2012;2015;REALIDADE AUMENTADA APLICADA A BIOENGENHARIA CRANIO-FACIAL: Desenvolvimento de um algoritmo de registro geométrico deformável em GPU;Realidade Aumentada
0170862557823567;Maurício Rosa;2018;Atual;Holográficos, Sensações e Sentidos: desvelando experiências estéticas por meio de Tecnologias de Realidade Aumentada na Cyberformação com professores de matemática;Realidade Aumentada
0170862557823567;Maurício Rosa;2017;Atual;Educação Matemática High Tech: da Cyberformação de Professores ao ensino e aprendizagem de matemática com o uso de interfaces naturais (tecnologias baseadas em gestos, sons e toque);Realidade Aumentada
0170862557823567;Maurício Rosa;2013;2014;Educação Matemática High Tech: da Cyberformação de Professores ao ensino e aprendizagem de matemática com o uso de interfaces naturais (tecnologias baseadas em gestos, sons e toque);Realidade Aumentada
2782156026516535;None;2009;2011;ENGINE DE CAPTURA DE MARCADORES NATURAIS EM TEMPO REAL EM SISTEMAS DE REALIDADE AUMENTADA;Realidade Aumentada
9261035835015495;Liane Margarida Rockenbach Tarouco;2018;Atual;AVAECIM;Realidade Aumentada
9261035835015495;Patrícia Fernanda da Silva;2018;Atual;AVAECIM - Ambiente Virtual de Aprendizagem Experimental em Ciências e Matemática,;Realidade Aumentada
9637121030877187;Alfredo Pina Calafi;2011;2014;Projeto Comunidade Européia  Alfa III  - Coordenador - Alfa Gaviota: Grupos Académicos para la VIsualización Orientada por Tecnologías Apropiadas;Realidade Aumentada
4607042780750206;Aléxia Pádua Franco;2015;2021;Formação histórica e educação patrimonial  em espaços educativos escolares e não escolares: tecnologias de informação, memória e História em diálogo;Realidade Aumentada
4339989455841703;André Luis Marques da Silveira;2012;2013;Educação formal/informal em museu através da tecnologia de Realidade Aumentada;Realidade Aumentada
4339989455841703;André Luis Marques da Silveira;2011;2012;Mediação na Arte: por uma experiência museológica dialógica em Realidade Aumentada;Realidade Aumentada
4339989455841703;André Luis Marques da Silveira;2010;2011;O estado da arte da Realidade Aumentada: abordagens teórico-práticas no ensino e aprendizagem;Realidade Aumentada
5458829100371043;Doris C C K  Kowaltowski;2020;Atual;User-Valued Innovations for Social Housing Upgrading through Trans-Atlantic Living Labs;Realidade Aumentada
5458829100371043;Regina Coeli Ruschel;2015;2018;O MANUAL DO PROPRIETÁRIO DA EDIFICAÇÃO INCORPORANDO A REALIDADE AUMENTADA;Realidade Aumentada
5458829100371043;Regina Coeli Ruschel;2012;2015;Rede Cooperativa de Pesquisa FINEP - TICHIS;Realidade Aumentada
7909125807301431;Fabiano Utiyama;2007;2008;Aplicações Interativas Educativas utilizando Realidade Virtual e Aumentada;Realidade Aumentada
7835935043066010;Eloisa Dezen Kempter;2020;Atual;VARREDURA DIGITAL, MODELOS INTELIGENTES E REALIDADE VIRTUAL PARA DOCUMENTAÇÃO, GESTÃO E DIVULGAÇÃO DA PAISAGEM CULTURAL DA UNIDADE DE CONSERVAÇÃO PARQUE ESTADUAL ILHA ANCHIETA (PEIA);Realidade Aumentada
7221692456270122;Isabel Cristina Siqueira da Silva;2022;Atual;Realidade Estendida e Visualização Analítica Imersiva no apoio ao Ensino em Saúde;Realidade Aumentada
7221692456270122;Isabel Cristina Siqueira da Silva;2018;2019;Design de Interação e Realidade Mista no Processo de Descoberta de Conhecimento na Área da Saúde;Realidade Aumentada
